job_url,site,title,company,location,job_type,date_posted,interval,min_amount,max_amount,currency,is_remote,num_urgent_words,benefits,emails,description
https://www.linkedin.com/jobs/view/3737749293,linkedin,Android Developer,PT FIRST WAP INTERNATIONAL (1rstWAP),"Jakarta, Indonesia",fulltime,2023-10-12,,,,,,0,,,"1rstWAP is looking for an Android developer responsible for the development and maintenance of applications aimed at a vast number of diverse Android devices. Your primary focus will be the development of Android applications and their integration with back-end services . You will be working along-side other engineers and developers working on different layers of the infrastructure. Therefore, the commitment to collaborative problem solving, sophisticated design , and creating quality products is essential. ResponsibilitiesMobile Application code following software requirements specification as setting up by the Development Department Manager or direct supervisor, this includes:Research the technology used for the implementation,Analyze the specifications for the implementation,Estimate production time for the implementation,Design of the code implementation,Write unit tests for the implementation,Write the code, following 1rstWAP's coding guidelines,Maintaining proper documentation of the code.Set up and maintain system (code) performance tests and execute code refactoring for existing code,Perform thorough code reviews of other programmers,Testing the implementation in a local environment, also checking logs and the user interface for flaws,Providing training of department personnel and others on IT development issues related to his development scope and/or technical skills,If needed, provide technical support for installations done at the client,Use our project management tool to report progress,Find, analyze, and fix reported bugs in our systems,If needed, participate in internal meetings, workshops and presentations,If needed, participate in meetings with partners and clients,Ensuring the integrity of the workplace (no downloads, no private code or data, etc.).RequirementsYou hold a bachelor degree in Computer Science or IT discipline,You have at least 2 years of working experience in this sector (fresh graduates are occasionally welcome too!),Strong mobile application programming knowledge using Java or other mobile application code,Experienced in design pattern (MVC or MVVM) will be an advantages,Experienced in mobile application UI and UX will be an advantages,Strong knowledge of mobile application DB,Experienced working in Linux environment,Experienced working with Git,Experience with RESTful programming,Experienced in writing unit tests,Familiar working with Android Studio or other IDE,Preferred: experienced with Redmine,Ability to communicate with English effectively, both orally and in writing.We Offer A competitive remuneration package with social benefits, Additional family health insurance, Training and professional development, Career path in a rapidly growing company, Skilled co-workers to share experience with, A friendly and non-conflict working environment, Retirement plan."
https://www.linkedin.com/jobs/view/3575866425,linkedin,Android Developer - Mining Software Company,Michael Page,"Bali, Indonesia",,2023-03-29,,,,,,,Actively Hiring,,
https://www.linkedin.com/jobs/view/3728989391,linkedin,Mobile Developer,Staffinc Group,,,2023-09-27,,,,,,,,,
https://www.linkedin.com/jobs/view/3752390147,linkedin,Mobile Developer,KMPlus Consulting,"Jakarta, Indonesia",,,,,,,,,Be an early applicant,,
https://www.linkedin.com/jobs/view/3607478950,linkedin,Software Engineer - Mobile,Mekari,,fulltime,2023-04-22,,,,,,0,Actively Hiring,,"Mekari is Indonesia's no. 1 Software-as-a-Service (SaaS) company. Our mission is to empower businesses and professionals to progress effortlessly. Our products (Mekari Talenta, Mekari Jurnal, Mekari KlikPajak, & Mekari Qontak) have been used by tens of thousands of businesses in Indonesia.To reach millions, we need more people like you: entrepreneurs, builders, owners inside the company who are eager to grow at scale. Join us to empower more businesses with technology.Job DescriptionsDesign and build advanced applications for the iOS/Android platform.Troubleshoot and solve various mobile application issues.Continuously discover, evaluate, and implement new technologies to maximize development efficiency.Develop and propose new products or features by monitoring user feedback.Work closely with cross-functional teams to define, design, and ship new features.Requirements/QualificationsBachelor’s degree in Computer Science, a related technical field, or equivalent practical experience from a reputable universityHave basic knowledge of programming languageUnderstand iOS / Android application life cycleComfortable solving complex problems through technologyHumble and hungry engineer. Always curious, always looking for a better way.Have extraordinary verbal & written English.Mobile Development SkillsFamiliar with OOP and have a good understanding on how to apply SOLID principles in codeFamiliar with the concept and implementation of Continuous IntegrationExperience working with web services and API’s (JSON, REST)Proficient understanding of code versioning tools (preferrably Git)Experience in writing Unit TestsFamiliar with Cloud Message APIs and Push NotificationsWhat You Will Get Competitive salary + daily allowance. Premium private health insurance (outpatient, inpatient, maternity, dental). Early access to salary + flex installment (employee loan) via Mekari Flex. Allowance for sports activities and glasses/contact lenses. Flexible working hours and remote work culture with free co-working space services. Annual and unpaid leaves from day 1 of join date + unlimited sick leave with doctor note. Notebook Ownership Program. Strategic office location, accessible by MRT. Friendly and dynamic work environment. Opportunity to take part in growing Indonesia's no. 1 SaaS companyOur team will review your application and will be in touch if your application is shortlisted to the next stage. If you do not hear from us in 30 days, we will keep your resume on file in case a relevant opportunity opens up.Don't forget to check our Recruitment FAQ at bit.ly/RecruitmentFAQ-Mekari [ENG] or bit.ly/RekrutmenMekari-FAQ [INA] to find the answers to commonly-asked questions regarding our recruitment process.We wish you the best. Hope to see you around soon!"
https://www.linkedin.com/jobs/view/3743841045,linkedin,Mobile Developer,PT. Neural Technologies Indonesia,,fulltime,2023-10-26,,,,,,0,Be an early applicant,,"RequirementsExperienced min. 1 (one) year as a Mobile DeveloperProficient with React NativeKnow Dart, HTML, CSS, and Web TechnologyCan work using Figma (implementation from design to coding)Familiarity with RESTful APIs to connect mobile applications to back-end services.Knowledge of other web technologies and UI/UX standards.ResponsibilitiesDeveloped mobile-based management information system applicationSet up and initiate the project using Clean Architecture and Bloc approach.Develop several features for a partner company and clients using React NativeDeveloped flutter package for modularity and reusability purposes.Implement Firebase Cloud MessagingDeployed and Updated the newest version app for iOS and Android"
https://www.linkedin.com/jobs/view/3744323646,linkedin,Java Developer,PT. Aero Systems Indonesia (Garuda Indonesia Group),,,2023-10-27,,,,,,,Actively Hiring,,
https://www.linkedin.com/jobs/view/3731071968,linkedin,Software Engineer (Android),Tokopedia,"Yogyakarta, Indonesia",fulltime,2023-10-10,,,,,,0,Actively Hiring,,"What You Will DoDesign, build and improve the online and offline mobile experiences for our productsPartner with the product management team to define and execute the feature roadmapCreate the unit test with a high code coverage percentage, and accurately cover the whole business logic and ensure non-flakinessCoordinate with cross functional teams (i.e. Backend, DevOps, Design etc.) on planning and executionProactively manage stakeholders communication related to deliverables, risks, changes and dependenciesInternalize and utilize GoTo's values in daily interactionsMentor and provide career guidance for junior engineers on your teamCommunicate, collaborate and work effectively across cross functional teams in a global environmentWhat You Will NeedAt least 1-4 years of experience with Android developmentProficiency in Kotlin programming, Android Studio, unit test, mobile database and the Android SDKStrong understanding of Android Apps architecture and implementationAbility to write model code for functional and nonfunctional requirements and help improve the code quality standard across the teamWorking experience with popular libraries for networking, concurrency, async, mobile database etcWell-versed with Agile methodologies, Jira, Git, CI/CD, Test Engineering and AutomationAbout GoTo GroupGoTo Group is the largest digital ecosystem in Indonesia with its mission to “Empower Progress’ by offering technological infrastructure and solutions for everyone to access and thrive in the digital economy. The GoTo ecosystem consists of on-demand transportation services, e-commerce, food and grocery delivery, logistics and fulfillment, as well as financial and payment services through the Gojek, Tokopedia and GoTo Financial platforms.It is the first platform in Southeast Asia that hosts these crucial cases in a single ecosystem, capturing the majority of Indonesia’s vast consumer household.About Gojek Gojek is Southeast Asia’s leading on-demand platform and pioneer of the multi-service ecosystem with over 2.5 million driver partners across the regions offering a wide range of services such as transportation, food delivery, logistics and more. With its mission to create impact at scale, Gojek is committed to resolving consumer problems and raising standards of living by connecting consumers to the best providers of goods and services in the market.About GoTo FinancialGoTo Financial accelerates financial inclusion through its leading financial services and merchants solutions. Its consumer services include GoPay and GoPayLater and serve businesses of all sizes through Midtrans, Moka, GoBiz Plus, GoBiz, and Selly. With its trusted and inclusive ecosystem of products, GoTo Financial is open to new growth opportunities and aims to empower everyone to Make It Happen, Make It Together, Make It Last.About Tokopedia Tokopedia is an Indonesian technology company with a mission to democratize commerce through technology. It has been a driving force behind Indonesia's digital development since its foundation in 2009, with more than 99% of districts and empowered around 12 million merchants listed nationwide. With Nakama ranging all across Indonesia, Tokopedia aims to simplify the lives of many to #FindYourPurpose together.About GoTo LogisticsGoTo Logistics (GTL) strives to evolve the nationwide logistics and fulfillment landscape as part of GoTo—Indonesia’s largest technology group. Through its flagship brand Dilayani Tokopedia, GTL offers a variety of services for sellers across Indonesia to significantly shorten their distance to customers and reduce their excessive workload—from receiving customer orders to packing and shipping through various logistics agents. GTL strives to move with the speed of growth, disrupt and create a lasting impact, and learn as we evolve to deliver the best possible logistics experience for sellers and buyers everywhere."
https://www.linkedin.com/jobs/view/3743234474,linkedin,"Software Engineer, Mobile (Android)-Fulfilment",Grab,,,2023-10-20,,,,,,,,,
https://www.linkedin.com/jobs/view/3731576335,linkedin,Mobile Application Developer - Jogja,PT. Varnion Technology Semesta,,fulltime,2023-10-11,,,,,,0,Actively Hiring,,"Company Description: Job Description: Develop high-quality, maintainable, and efficient Flutter applications for both iOS and Android platforms. Collaborate with designers to translate UI/UX design wireframes into functional Flutter applications. Integrate with backend services and APIs to deliver end-to-end app functionality. Implement state management solutions such as Provider or Bloc to handle application state. Optimize app performance and responsiveness for various device sizes and orientations. Troubleshoot and debug issues, and provide timely solutions to address bugs and glitches. Stay up-to-date with the latest Flutter and mobile app development trends, techniques, and technologies. Participate in code reviews to maintain code quality, readability, and best practices. Work closely with the product team to gather requirements and provide technical input during the planning phase."
https://www.linkedin.com/jobs/view/3736903636,linkedin,Android Developer (Contract Based),Aleph-Labs,"Jakarta, Indonesia",contract,2023-10-10,,,,,,0,Actively Hiring,,"Design and build advanced applications for the Android platform Collaborate with cross-functional teams to define, design, and ship new features Writes design/implementation documentation Be responsible for designing, implementing, unit testing, code reviewing in various components/projects Work with outside data sources and APIs Unit-test code for robustness, including edge cases, usability, and general reliability Work on bug fixing and improving application performance Continuously discover, evaluate, and implement new technologies to maximize development efficiency Be a part of whole product life cycle, Dream, Build, Run and Iterate Work with the design team to perfect the UI and UX Lead and coach a team Adheres to strict delivery schedulesMinimum QualificationsStrong OO design and programming skills in KotlinAmple experience in Android SDKKnowledge of SQLite, MySQL or similar database management systemFamiliar with Android StudioUnderstanding of other compiled languagesExperience on web service integration (SOAP, REST, JSON, XML)Experience of development using web technologiesGood understanding of OO programming and design patternsGood understanding of HTML5, JavaScript, jQuery, Ajax and PHPExperience building web and native appsExperience using social media APIsExcellent debugging and optimisation skillsMinimum 3 years of experience as an Android Developer"
https://www.linkedin.com/jobs/view/3744322788,linkedin,IOS Developer,PT. Aero Systems Indonesia (Garuda Indonesia Group),,,2023-10-27,,,,,,,Actively Hiring,,
https://www.linkedin.com/jobs/view/3017410652,linkedin,Mobile Developer (Android/Flutter) - BSA,Alterra Indonesia,,fulltime,2022-03-19,,,,,,0,,,"Job Description :● Translate designs and wireframes into high quality code Kotlin/Java/Flutter● Build best practice applications architecture for the Android platform● Collaborate with cross-functional teams to define, design, and ship new features● Work with outside data sources and APIs● Unit-test code for robustness, including edge cases, usability, and general reliability● Work on bug fixing and improving application performance● Continuously discover, evaluate, and implement new technologies to maximize development efficiency & automatization Requirements :● Hands on experience and strong proficiency but not limited to Kotlin with strong foundations in Java Object Oriented Programming● Experience and strong proficiency but not limited to Flutter with strong foundations in Dart, BloC, GetX, ● Experience with Design Patterns, Clean Code fundamental● Proven working experience in Android app development and Have published at least one original Android app● Experience working with remote data via REST API and JSON● Experience with third-party libraries and APIs● Good understanding of interactive application development paradigm● Working knowledge with Android Jetpack, dagger, hilt, mock or equivalent libraries on Android● Ability to understand and implement continuous Integration and continuous delivery principles"
https://www.linkedin.com/jobs/view/3751467260,linkedin,Android Developer,PT Integra Pratama,,fulltime,2023-11-01,,,,,,0,Actively Hiring,,"The ideal candidate will be able to appropriately identify the needs of both new and current customers in order to aid customers in their success using our product. This will be done by developing an appropriate level of communication with clients and internal team members to better understand and mitigate any issues the customers may face.ResponsibilitiesAnalyze and optimize app performance to provide a fast and smooth user experience.Develop and maintain unit tests to ensure code accuracyCreate and maintain documentation of application design and codebaseStay up-to-date with the latest Android technologies and trendsQuality and compatibility with the existing codebaseQualificationsBachelor Degree in Information Technology/Computer Science/Software Engineering, or related IT fieldAt least experience 3-5 years in full-time, production-level mobile development experience in Android using Java/Kotlin, FlutterExperience in Cashier Software Apps is preferred.Experienced in authoring, testing, deploying, and managing workflows for high-scale production mobile appsWell-updated with the latest trends in Android technologies, loves to explore new things and enjoys sharing new things for the teamDeep technical knowledge in developing secure, performant and well-architected Android apps.Strong understanding in OOP and architectural pattern (MVVM preferred)Experience in test-driven development and continuous integration/deployment (CI/CD)Able to troubleshoot complex systems problems, debug, and find root causesFamiliar with Git and Git workflowsExcellent verbal and written communication skillsGreat problem-solving skills & strong analytical capabilityHigh motivated person and good personality"
https://www.linkedin.com/jobs/view/3743096063,linkedin,Web Developer,PT Solomon Indo Global,,fulltime,2023-10-26,,,,,,0,,,"Company Description: PT Solomon is a company engaged in self care with the brands Bromen, Hipnotic, Whitenic. This company was first launched and debuted in the Indonesian market in mid-2020. Currently we are trying to develop as fast as possible to provide the quality of each product is very good and guarantees with quality that can last longer. Every individual here can bring their purpose to life through their work. Join us and you’ll be surrounded by inspiring leaders and supportive peers. Among them, you’ll channel your purpose, bring fresh ideas to the table, and simply be you. As you work to make a real impact on the business and the world, we’ll work to help you become a better you. Job Description:Web Developer"
https://www.linkedin.com/jobs/view/3744501932,linkedin,Android Developer (Kotlin),PHINCON,"Jakarta, Indonesia",fulltime,2023-10-20,,,,,,0,Actively Hiring,,"Qualification· In-depth knowledge of programming languages of Kotlin Android SDK Sample portfolio of released applications on the Google PlayStore (Android market) is a plus · Understanding of Google's Android design principles and interface guidelines · Familiar with OOP design principles · Experience designing and developing client applications in Java. · Familiar with Sensor and push notification · Good understanding of software engineering concepts, algorithms, and design patterns (MVC, MWM or MVP) · Experience with agile (Scrum, Kanban) software development is a plus. · Experience using agile tools such as CU, jenkins, gitHub, Agile Tools (JIRA, Confluence) · Familiarity with code versioning tools GIT · Having experience Agile Scrum· Familiarity with Lib Jetpack & Dependency Injection Job DescriptionExperience: Minimum 3 years of working experience as an Android Developer in project (real project environment and team)Team Working Skill: able to work in a team and have a good team working attitudeAnalytical Skill: able to look at complex data and computer systems and find inefficiencies analyze weaknesses or security threats,Problem-Solving Skill: Able to analyze an issue, security threat or problem and make decisions on how to proceedCreativity: Finding new and innovative solution to problems requires CreativityCommunication Skill: Able to speak to clients providing recommendations, listen to concerns and communicate with teammates.Presentation Skill: Able to present their findings and recommendations to their contracted company and their own management"
https://www.linkedin.com/jobs/view/3742032984,linkedin,Mobile Engineer,BRIK,,fulltime,2023-10-18,,,,,,0,Actively Hiring,,"ResponsibilitiesDevelop and maintain mobile applications for both iOS and Android platforms using Flutter and React Native.Collaborate with designers and product managers to implement user interfaces and features.Write clean, efficient, and maintainable code.Debug and resolve software defects and issues.Stay up-to-date with the latest trends and technologies in mobile development.Participate in code reviews and provide constructive feedback to team members.Continuously improve the performance and user experience of our mobile apps.Work in an agile development environment, meeting project deadlines and milestones.RequirementsMinimum 2 years of proven experience in mobile app development for iOS and Android platforms.Proficiency in Flutter and React Native.Strong knowledge of mobile app architecture and design patterns.Familiarity with RESTful APIs and third-party integrations.Experience with version control systems such as Git.Excellent problem-solving skills and attention to detail.Ability to work collaboratively in a team and communicate effectively.A passion for staying updated on emerging mobile technologies and best practices."
https://www.linkedin.com/jobs/view/3726973280,linkedin,Software Developer,Ingenico,"Jakarta, Indonesia",fulltime,2023-10-28,,,,,,0,Actively Hiring,,"Ingenico is a global leader in the fintech market, with more than three decades of experience and employs over 7,500 people. Its footprint gives scale to projects and talents. Innovation is part of our DNA and our diverse community of experts keep anticipating the evolution of commerce worldwide.We provide merchants with a comprehensive and innovative range of services and solutions that eliminate payment complexity and make purchasing quick, seamless and secure for consumers, whatever the sales channel or payment method.JOB PURPOSE/MISSION:Software Developer to develop payment and other applications to meet clients' needs and requirements. To guide and train junior developers as acquiredAs a technical consultant to junior members in the team.KEY RESPONSIBILITIES Develop and timely release embedded C/C++ applications on POSDevelop and timely release payment applications on Android POSProvides support in the day-to-day resolution and fixes on applications for customers and new partnersProvides technical expertise and support to customers with regards to software development/coding / best practiceTrain and provide technical guidance to the junior developerDocuments and demonstrates solutions by preparing documentation, flowcharts, layouts, diagrams, charts, code comments and clear codeCORE COMPETENCIES Good knowledge/working experience on C/C++ (mandatory) or C-like language such as C#, Java on device developmentGood knowledge in Android development (Java, Kotlin,etc) • Has extensive knowledge of Software Development – C/C++, Software Development Lifecycle, Knowledge of credit card processing, developing applications with strict compliance with PCI DSS and EMV standards, POS application development and ISO8583 is a must.Knowledge of managing and implementing payments processing and banking/financial projects and solutions is an advantageGood understanding of data exchange format (XML, JSON, CSV, TLV)Python will be a plus pointKnowledge/experience on software management tool such as JIRA, Bitbucket, ConfluenceKEY PERFORMANCE OBJECTIVES/INDICATORS Timely and good quality software application releases.Able to meet client’s expectationsAble to work alongside with Projects Team in achieving the team’s overall objective.BEHAVIOUR SKILLS Detail-orientedTakes initiative and proactiveAnalytical and possess critical thinkingThrives in both tight deadlines, challenges and opportunitiesEDUCATION/EXPERIENCE REQUIREMENTSDiploma/University: Degree in Computer, Electronic, or Electrical Engineering or proficiency in embedded system, application development or web programmingYears of professional experience required: 7 to 10 years in the payment industry."
https://www.linkedin.com/jobs/view/3738146684,linkedin,WEB DEVELOPER,PT Mulia Industrindo Tbk,,,2023-10-18,,,,,,,,,
