job_url,site,title,company,location,job_type,date_posted,interval,min_amount,max_amount,currency,is_remote,num_urgent_words,benefits,emails,description
https://id.indeed.com/viewjob?jk=a46741a7d07552a0,indeed,Android Developer,Apotek K 24,"Yogyakarta, YO, Indonesia",,2023-10-04,,,,,False,0,,,Designing and building mobile applications for Android platform. Ensuring quality and performance of application to specifications.
https://id.indeed.com/viewjob?jk=9c210e0be492154b,indeed,Android Developer,Humana International,Indonesia,,2023-01-12,,,,,False,0,,,"Experienced in making android applications using Java/Kotlin, SQLite. Experienced with Google Service(Firebase,Analytics,Firebase) and Facebook SDK."
https://id.indeed.com/viewjob?jk=f3fb0dd5fee33583,indeed,Android Developer,ITommey Bintang Indonesia,"Jakarta, JK, Indonesia",fulltime,2023-09-12,monthly,5000000,7000000,IDR,False,0,,,Minimum 1 Years experience in android development with Kotlin. Bachelor Degree OF Computer Science is A Must. has experience with MVP/MVVM Architecture.
https://id.indeed.com/viewjob?jk=116ef86b078ce876,indeed,Android Developer,Mekari (PT. Mid Solusi Nusantara),"Jakarta, JK, Indonesia",,2022-02-16,,,,,False,0,,,"Familiarity with using Android Studio profiler tools for debugging, profiling android apps. Extensive programming experience in Kotlin programming language …"
https://id.indeed.com/viewjob?jk=a1294ede29a51ecf,indeed,Android Developer,PT INTI SOLUSI DINAMIS,"Depok, JB, Indonesia",fulltime,2023-09-20,monthly,2500000,3000000,IDR,False,0,,,"Pernah mengembangkan aplikasi android menggunakan framework atau native. Memliki kemampuan design UI yang baik. Job Types: Full-time, Fresh graduate."
https://id.indeed.com/viewjob?jk=a3668e53f2ba7fd0,indeed,Android Developer,Farmers Market 99 Indonesia,"Jakarta, JK, Indonesia",fulltime,2023-08-29,,,,,False,0,,,"Cooperating with back-end developers, designers, and the rest of the team to deliver well-architected and high-quality solutions."
https://id.indeed.com/viewjob?jk=770f6dae2d1b00b6,indeed,Android Developer,Akar Inti Teknologi (AIT),Indonesia,fulltime,2022-02-04,,,,,False,0,,,"Collaborate with Back-End developers to integrate user-facing elements. Participate in the entire application lifecycle, focusing on coding and debugging."
https://id.indeed.com/viewjob?jk=65d078a8d23ca463,indeed,Android Developer,Humana International,"Jakarta, JK, Indonesia",,2023-01-21,,,,,False,0,,,"1 - 3 years work experience in the same field (IOS Developer). Well experienced in Java - Android Studio. Deep understanding about OOP, MVP & Clean Architecture…"
https://id.indeed.com/viewjob?jk=ab3fbd3c03d1cdc3,indeed,Android Developer,MSBU,"Jakarta, JK, Indonesia",contract,2023-10-28,monthly,0,15000000,IDR,False,,,,
https://id.indeed.com/viewjob?jk=e7712546b2094a6a,indeed,Android Developer,Diksha Technology Indonesia,"Jakarta, JK, Indonesia","temporary, fulltime, contract",2023-10-20,monthly,10000000,25000000,IDR,False,0,,,"Memiliki pengalaman dalam mendevelop aplikasi android dengan Kotlin, Android Jetpack, Retrofit2, Coroutines, Dependency Injection (eg: Dagger2)."
https://id.indeed.com/viewjob?jk=e324fdebc1bed2f1,indeed,Android Developer,Kompas.com,"Jakarta, JK, Indonesia",fulltime,2021-08-09,,,,,False,0,,,Bachelor’s degree in Computer Science (or equivalent degree or experience). 1+ years professional experience with Objective-C for iOS and or Android Frameworks.
https://id.indeed.com/viewjob?jk=e96ea161b08626aa,indeed,Android Developer,Techarea,"Semarang, JT, Indonesia",fulltime,2022-07-07,,,,,False,,,,
https://id.indeed.com/viewjob?jk=2d6018b2eb3d461e,indeed,Android Developer,seven light,"JB, Indonesia",,2023-02-03,,,,,False,0,,,"Pendidikan min SMK (Rekayasa Perangkat Lunak) / D3 Informatika. Mahasiswa tingkat akhir, Fresh graduate dipersilakan untuk melamar."
https://id.indeed.com/viewjob?jk=269ed971d837d518,indeed,Android Developer,SALT,"Jakarta, JK, Indonesia",fulltime,2023-08-24,monthly,8000000,-1,IDR,False,0,,,Bachelor degree of Information / System Engineering or related. Minimum >3 years experience as an Android Developer. Android Developer: 2 years (Preferred).
https://id.indeed.com/viewjob?jk=e1040d347830c1f2,indeed,Android Developer,PT Lawencon Internasional,"Jakarta, JK, Indonesia","fulltime, contract",2023-10-10,monthly,8000000,12000000,IDR,False,0,,,Monitor the application by fixing bugs and improving application performance regularly. Implement and be responsible for delivering and managing versions of…
https://id.indeed.com/viewjob?jk=14830be56994e001,indeed,Android Developer,Techtiera Services Indonesia,"Jakarta, JK, Indonesia",contract,2023-10-21,,,,,False,0,,,"Minimum of education: Bachelor's Degree (GPA : 3.00). Have minimum of 1-2 years of experiences. Tech used: Kotlin, Java, ReactNative, RxKotlin."
https://id.indeed.com/viewjob?jk=0154e67405af789f,indeed,Android Developer,Phintraco Consulting,"Jakarta, JK, Indonesia",,2023-01-10,,,,,False,0,,,"Translate designs and wireframes into high-quality code. Design, build, and maintain high performance, reusable and reliable Java code."
https://id.indeed.com/viewjob?jk=f96e9ff01b817d82,indeed,Android Developer,Technology & Information COMPANY,"Jakarta, JK, Indonesia","fulltime, contract",2023-10-23,,,,,False,0,,,"At least 1 year of experience as a Native Android Developer (Java). Experienced in using Android Development Tools (Android Studio, API, Android SDK, GIT)."
https://id.indeed.com/viewjob?jk=1a6140277bf8e9c4,indeed,Android Developer,Humana International,"Jakarta, JK, Indonesia",,2022-11-11,,,,,False,0,,,"Will be working along-side product manager, analyst and developers working on different layers of the infrastructure."
https://id.indeed.com/viewjob?jk=b0e036393009a9e3,indeed,Android Developer,Aleph Labs,"Jakarta, JK, Indonesia",,2023-10-09,,,,,False,0,,,"Collaborate with cross-functional teams to define, design, and ship new features. Be responsible for designing, implementing, unit testing, code reviewing in…"
https://id.indeed.com/viewjob?jk=08933b3131593d24,indeed,Android Developer,KinerjaPay Corp.,"Jakarta, JK, Indonesia",fulltime,2021-07-27,,,,,False,0,,,"Manage the full technical life-cycle during each development phase. Collaborate with team to brainstorm about new products, provide each other with technical…"
https://id.indeed.com/viewjob?jk=b9b7deeeb544fbe6,indeed,Android Developer,Vodjo Teknologi Indonesia,"Bandung, JB, Indonesia",,2023-03-30,,,,,False,0,,,"You will be working along-side developers working on different layers of the infrastructure. Strong knowledge of Android SDK, different versions of Android, and…"
https://id.indeed.com/viewjob?jk=1fe465f71cb35d37,indeed,Android Developer,Lawencon International,"Jakarta, JK, Indonesia",fulltime,2022-11-18,,,,,False,0,,,"Collaborate with cross-functional teams to define, design, and ship new features. Work with outside data sources and APIs."
https://id.indeed.com/viewjob?jk=c2cab9450e5b965a,indeed,Android Developer,GESTALT CENTER,"Bandung, JB, Indonesia",fulltime,2023-10-20,,,,,False,0,,,"Mengerjakan projek mobile developer: 1 tahun (Diutamakan). Memiliki pengetahuan MySQL, konsep OOP, Nodejs, PHP dan REST API."
https://id.indeed.com/viewjob?jk=b9a6e143d828203b,indeed,Software Engineer,Tokopedia,"Yogyakarta, YO, Indonesia",fulltime,2023-10-06,,,,,False,0,,,"Practical experience in full-SDLC cycle, with large-scale live roll-out participation as a developer. Design improvements to our existing product (in the…"
https://id.indeed.com/viewjob?jk=565e647899569735,indeed,Android Developer,PT KB Insurance Indonesia,"Jakarta, JK, Indonesia","fulltime, contract",2023-07-28,monthly,6000000,9000000,IDR,False,0,,,Have experianced develop android/mobile application with teams or individual. Candidate must possess at least Bachelor’s Degree in Engineering (Computer…
https://id.indeed.com/viewjob?jk=bbd158fcfc8bc57c,indeed,Mobile Developer,Digital Art,"Tangerang, BT, Indonesia","fulltime, contract",2023-10-11,monthly,3500000,7000000,IDR,False,0,,,"Kami Digital Agency dengan kantor yang berlokasi di Alam Sutera Tangerang, membutuhkan Full Time Bidang Mobile App Developer baik junior maupun senior dengan…"
https://id.indeed.com/viewjob?jk=0f4a6884adf9c2b2,indeed,Android Developer,Civimi,"Jakarta, JK, Indonesia",,2019-10-10,,,,,False,0,,,"Candidate must possess at least Diploma in Engineering (Computer/Telecommunication), Computer Science/Information Technology or equivalent."
https://id.indeed.com/viewjob?jk=81c741cd9ed4a91c,indeed,Software Engineer,Tokopedia,"Yogyakarta, YO, Indonesia",fulltime,2023-10-06,,,,,False,0,,,"Practical experience in full-SDLC cycle, with large-scale live roll-out participation as a developer. Design improvements to our existing product (in the…"
https://id.indeed.com/viewjob?jk=40b5a11e887fa6b8,indeed,Android Developer,Humana International,"Jakarta, JK, Indonesia",,2022-11-10,,,,,False,0,,,"Involved in the full Android development life cycle, including design, prototyping, sprint planning, code review, etc. Familiar with unit testing, TDD or BDD."
https://id.indeed.com/viewjob?jk=0c8d2816f01313bf,indeed,Mobile Developer,Varnion Technology Semesta,"Badung, BA, Indonesia",fulltime,2023-10-10,,,,,False,0,,,Contributing to the development of project schedules and workflows. Recommending changes and enhancements to software applications.
https://id.indeed.com/viewjob?jk=e93eae47e1a9e33b,indeed,Android Developer,QSI Recruitment,"Tangerang, BT, Indonesia",,2020-11-16,,,,,False,0,,,"Bachelor degree majoring Information Technology, Computer Engineer or equivalent. Minimum 1 year experience in Android Development."
https://id.indeed.com/viewjob?jk=1f5e34d7a528dff0,indeed,Android Developer,PT Phintraco Technology,"Jakarta, JK, Indonesia",fulltime,2023-10-03,,,,,False,0,,,Work with backend developers to build new features and integrations. Translate designs and wireframes into high-quality code. Familiar with Library and API.
https://id.indeed.com/viewjob?jk=804154686b0c6fb4,indeed,Android Developer,Dans Multi Pro,"Jakarta, JK, Indonesia",fulltime,2023-07-13,,,,,False,0,,,"Ensure the performance, quality, security and responsiveness of applications. Troubleshoot and debug to optimize performance."
https://id.indeed.com/viewjob?jk=c321060c6fe8ec47,indeed,Android Developer,Humana International,"Jakarta, JK, Indonesia",,2023-02-08,,,,,False,0,,,"Design, develop and maintain high quality software for EFTPOS terminals. Translate designs and functional specification document into high-quality code."
https://id.indeed.com/viewjob?jk=07d8394edcf68270,indeed,Android Developer,PT Atask Teknologi Internasional,"Jakarta, JK, Indonesia",,2023-02-09,,,,,False,0,,,Minimum 4 years of experience as an Android application developer. Collaborate with relevant teams to define and design new features.
https://id.indeed.com/viewjob?jk=5b933b059ab7176c,indeed,Android Developer,Code.id,"Jakarta, JK, Indonesia",fulltime,2023-09-04,,,,,False,0,,,Have 3 years experience as Android developer. Work on design for the new feature requests in the Mobile App. Configure the Continuous Integration and Continuous…
https://id.indeed.com/viewjob?jk=4463f9dd2c0983ff,indeed,Android Developer,Dans Multi Pro,"Jakarta, JK, Indonesia",internship,2023-10-11,,,,,False,0,,,"5th semester student or Fresh graduate from Bachelor or Diploma Degree in Engineering (Computer / Telecommunication), Computer Science / Information Technology…"
https://id.indeed.com/viewjob?jk=dd7ba77deb55698f,indeed,Android Developer,PT Stampindo Lancar Jaya,"Jakarta, JK, Indonesia",,2023-06-14,,,,,False,0,,,Good understanding of programming language fundamentals and concepts. Solid understanding of object oriented programming language.
https://id.indeed.com/viewjob?jk=f4943f5ecb6db187,indeed,Android Development,Accenture,"Jakarta, JK, Indonesia",fulltime,2021-08-02,,,,,False,0,,,"Experience leading small teams of developers. You are required to closely on a cross functional team including other developers, designers, Project Managers, QA…"
https://www.linkedin.com/jobs/view/3748534415,linkedin,"Software Engineer, Mobile - Android",Grab,,fulltime,2023-10-25,,,,,,0,,,"Job Description:Life at GrabAt Grab, every Grabber is guided by The Grab Way, which spells out our mission, how we believe we can achieve it, and our operating principles - the 4Hs: Heart, Hunger, Honour and Humility. These principles guide and help us make decisions as we work to create economic empowerment for the people of Southeast Asia.Get to know the TeamDNA (Demand and Ads) mobile team leverages promotions and advertisements to optimize user experience is a specialized group of professionals dedicated to enhancing user engagement within mobile applications. Our team combines the skills and responsibilities of mobile app development with the strategic use of promotions and ads to create a more engaging and user-friendly experience.In order to optimize Grab's various services, our team should employ data-driven strategies such as user segmentation, geolocation-based promotions, and in-app ads while collaborating with multiple teams and components include partnering with local businesses and restaurants for cross-promotions, analyzing user feedback and survey data. Additionally, the team should focus on user engagement promotions, A/B testing, and continuously monitor ad performance. This multifaceted approach, involving various stakeholders and components, prioritizes user privacy and delivers a personalized and valuable user experience.Get to know the RoleWe are seeking Android app developers who are primarily responsible for learning and gaining practical experience in programming languages like Java and Kotlin, as well as the Android tech stack. They assist in coding, UI development, testing, and integration tasks. Engineers should contribute to project discussions, documentation, and collaborate with cross-functional teams, all while focusing on skill development and continuous learning to progress in their development career.The Day-to-Day ActivitiesApp Development: Create, enhance, and maintain the Grab app.Ad Integration: Ensure seamless ad and promotion integration.User Engagement Features: Develop features for better user engagement.Collaboration with QA and UX: Work closely with QA and UX teams.Performance Monitoring: Continuously monitor app performance.Code Reviews: Engage in code reviews for quality assurance.Documentation: Document changes and integrations.End-of-Day Review: Evaluate daily progress and plan for the next day.The Must-HavesStrong CS fundamentals (with competencies in algorithms and data structures).Proficient in Kotlin for Android.Good understanding of UX/UI design exposure and in making apps work intuitively and withpixel perfect interfaces.Familiar with MVVM, RxJava and Clean Architecture.The Nice-to-HavesA degree in computer science, software engineering, information technology or related fields.Up-to-date on the modern Android programming paradigm, including the use of Coroutine, Jetpack Compose.Working knowledge of several architectural approaches, caching, data storage and security.2-4 years of mobile engineering experience with a track record of building complex applicationsOur CommitmentWe recognize that with these individual attributes come different workplace challenges, and we will work with Grabbers to address them in our journey towards creating inclusion at Grab for all Grabbers."
https://www.linkedin.com/jobs/view/3736947180,linkedin,Android Developer,Dikshatek Indonesia,,fulltime,2023-10-10,,,,,,0,Actively Hiring,,Job Description Job Description: Bachelor degree2 years as Android developerRequired Skills Required Skills: Android
https://www.linkedin.com/jobs/view/3710595792,linkedin,Mobile App. Developer,Kessler Executive Search,,fulltime,2023-09-12,,,,,,0,,,"Company Description: We are a Head Hunting Company and we provide a good quality of Headhunter service in Indonesia. In general term, we are a Recruitment Agency and we provide a good quality of recruitment service to our clients. We serve our clients by placing the best candidates for their recruitment needs. We are working in various segments such as FMCG, Chemical, Plantation & Forestry, Pharmaceutical, Loyalty & Customer Product (Retail). Job Description:Mobile App. Developer"
https://www.linkedin.com/jobs/view/3744324566,linkedin,Android Developer,PT. Aero Systems Indonesia (Garuda Indonesia Group),,fulltime,2023-10-27,,,,,,0,Actively Hiring,,"Company Description: Asyst is an IT service provider which serve any industries in Business Solutions & Professional Services, Infrastructure & Managed Services, Product Fulfillment, and Digital Business. Job Description:This is a contract Android Developer role in Jakarta, Indonesia. The Android Developer will be responsible for mobile application development, Android design and development, and software development."
https://www.linkedin.com/jobs/view/3755548120,linkedin,Mobile Developer (Fulltime),Skolla EdTech,,fulltime,2023-11-03,,,,,,0,Actively Hiring,,"ResponsibilitiesDesign, develop and maintain mobile applications for Android and iOS platforms Collaborate with UI/UX designers to ensure a visually appealing and user-friendly interfaceDebug and troubleshoot problems within the mobile applicationsCreate and maintain documentation for code, technical specifications, and application architecturePerform code reviews and optimization to ensure maximum performance and quality of the applicationUtilize cross-platform development tools and technologiesFollow security best practices to protect data and application integrityRequirementsMinimum experience 1 year in the related fieldBachelor’s degree in Computer Science, Software Engineering, Information Technology, or related fieldDemonstrable portfolio of released applications on the App store or the Android marketExperience with several programming languages (Python, Kotlin, Swift, Java, etc.)Experience with MVVM or VIPER patternsKnowledge of mobile application development frameworks (React Native, Flutter, Xamarin)Understanding of software development principles, architecture, design patterns, and best practicesGood problem-solving, communication, and teamwork skills"
https://www.linkedin.com/jobs/view/3756431121,linkedin,Mobile Application Developer,Digisign.id,,fulltime,2023-11-04,,,,,,0,,,"ResponsibilitiesMembangun aplikasi Digisign untuk sistem operasi Android atau IOS.Melakukan update berkala untuk aplikasi mobile.Membangun Frontend Application untuk web mobile view.Mendiskusikan persyaratan yang diajukan mitra dan menawarkan solusi untuk rekan kerja.Mengembangkan application programming interfaces (API's) untuk mendukung fungsi mobile tetap up to date dengan teknologi, konsep, dan praktik terbaik dalam membuat code aplikasi mobile.RequirementsMinimal S1 Teknik Informatika, Sistem Informasi dan setara.Menguasai bahasa pemograman untuk aplikasi mobile yaitu Flutter.Menguasai konsep API.Mengetahui konsep SDLC.Mengerti UML Diagram.Menguasai HTML, CSS dan javascript.Mengetahui algoritma dasar dan bahasa pemrograman terkini."
https://www.linkedin.com/jobs/view/3749647151,linkedin,Android Developer,CODE.ID,,fulltime,2023-10-01,,,,,,0,Be an early applicant,,"Create Mobile Applications for Android using KotlinWork on design for the new feature requests in the Mobile App Configure the Continuous Integration and Continuous Delivery pipeline for your mobile apps.Create automation scripts to test the Mobile code being writtenMinimum QualificationsMust possess at least a Bachelor's Degree (S1) of Information Technology/Computer Science/Electrical Engineering/Mathematics.Have 3 years experience as Android developerExperience in using Java, Kotlin or Swift or Flutter or React NativeWorking knowledge of the general mobile architectures, trends, and emerging technologies.Solid understanding of the full mobile development life cycle.Patient, hard working, and fully dedicated.Willing to be placed at North Jakarta."
https://www.linkedin.com/jobs/view/3734546678,linkedin,Software Engineer - Mobile,Mekari,,fulltime,2023-09-14,,,,,,0,Actively Hiring,,"Mekari is Indonesia's no. 1 Software-as-a-Service (SaaS) company. Our mission is to empower businesses and professionals to progress effortlessly. Our products (Mekari Talenta, Mekari Jurnal, Mekari KlikPajak, & Mekari Qontak) have been used by tens of thousands of businesses in Indonesia.To reach millions, we need more people like you: entrepreneurs, builders, owners inside the company who are eager to grow at scale. Join us to empower more businesses with technology.Job DescriptionsDesign and build advanced applications for the iOS/Android platform.Troubleshoot and solve various mobile application issues.Continuously discover, evaluate, and implement new technologies to maximize development efficiency.Develop and propose new products or features by monitoring user feedback.Work closely with cross-functional teams to define, design, and ship new features.Requirements/QualificationsBachelor’s degree in Computer Science, a related technical field, or equivalent practical experience from a reputable universityHave basic knowledge of programming languageUnderstand iOS / Android application life cycleComfortable solving complex problems through technologyHumble and hungry engineer. Always curious, always looking for a better way.Have extraordinary verbal & written English.Mobile Development SkillsFamiliar with OOP and have a good understanding on how to apply SOLID principles in codeFamiliar with the concept and implementation of Continuous IntegrationExperience working with web services and API’s (JSON, REST)Proficient understanding of code versioning tools (preferrably Git)Experience in writing Unit TestsFamiliar with Cloud Message APIs and Push NotificationsFlutter Specific SkillsHave experience on developing one of iOS/Android apps in their own native language.Practical experience in using Flutter2 in mobile development.Understanding of State Management in Flutter.Familiar with declarative ui style thinking.What You Will Get Competitive salary + daily allowance. Premium private health insurance (outpatient, inpatient, maternity, dental). Early access to salary + flex installment (employee loan) via Mekari Flex. Allowance for sports activities and glasses/contact lenses. Flexible working hours and remote work culture with free co-working space services. Annual and unpaid leaves from day 1 of join date + unlimited sick leave with doctor note. Notebook Ownership Program. Strategic office location, accessible by MRT. Friendly and dynamic work environment. Opportunity to take part in growing Indonesia's no. 1 SaaS companyOur team will review your application and will be in touch if your application is shortlisted to the next stage. If you do not hear from us in 30 days, we will keep your resume on file in case a relevant opportunity opens up.Don't forget to check our Recruitment FAQ at bit.ly/RecruitmentFAQ-Mekari [ENG] or bit.ly/RekrutmenMekari-FAQ [INA] to find the answers to commonly-asked questions regarding our recruitment process.We wish you the best. Hope to see you around soon!"
https://www.linkedin.com/jobs/view/3736055434,linkedin,Mobile Technology Developer (intern),Kawan Lama Group,,fulltime,2023-10-11,,,,,,0,Actively Hiring,,"Gambaran PekerjaanSebagai Mobile Technology Developer (Intern), Anda akan bertanggung jawab dalam membuat interface dan user experience yang menarik untuk perangkat seluler, mengoptimalkan kinerja untuk aplikasi / web, mengikuti perkembangan tren industri terbaru dalam teknologi mobile/web, mengembangkan aplikasi seluler fungsional, serta memecahkan masalah dan men-debug untuk mengoptimalkan kinerja mobile/web.Kualifikasi Mahasiswa jurusan Teknik Informatika atau jurusan sejenis. Skill yang Dibutuhkan Information architecture Human computer interaction Prinsip mobile usability design HTML5, JavaScript, jQuery, Ajax, dan PHP Native Android/iOS Social media APIs"
