job_url,site,title,company,location,job_type,date_posted,interval,min_amount,max_amount,currency,is_remote,num_urgent_words,benefits,emails,description
https://www.linkedin.com/jobs/view/3735223327,linkedin,Data Science Intern,Funding Societies | Modalku Group,,temporary,2023-10-06,,,,,,0,,,"Funding Societies | Modalku is the largest SME digital financing platform in Southeast Asia. We are licensed in Singapore, Indonesia, Thailand, and registered in Malaysia. We are backed by Sequoia India and Softbank Ventures Asia Corp amongst many others and provides business financing to small and medium-sized enterprises (SMEs), which is crowdfunded by individual and institutional investors. And here at Funding Societies | Modalku we live by our core values:Serve with Obsession: Build win-win relationships for the long-term by having a customer obsessionGrow Relentlessly: Strive to become our best, most authentic selvesEnable Teamwork, Disable Politics: Only by forging togetherness, we help each other succeedTest Measure Act: Stay curious and reinvent ourselves, through innovation and experimentationFocus on Impact: Create impact through bias for action and tangible resultsWe are seeking a highly motivated and skilled Data Science Intern to join our dynamic team at Funding Societies. You will have the opportunity to work with a diverse team of experts in a collaborative and innovative environment. In this role, you will be responsible for analyzing large and complex datasets, developing predictive models, and providing insights that drive business decisions.RequirementsWhat will you do:Develop and implement machine learning algorithms for predictive modeling and data analysisAnalyze and interpret complex data to identify trends, patterns, and insightsCollaborate with cross-functional teams to identify opportunities to improve business performanceDesign A/B testing experiments to evaluate the effectiveness of new products, features, and marketing campaignsResearch best practices and methodologies in the field of fintech, AI, and machine learningWhat we are looking for:Currently pursuing or recently completed a degree in data science, computer science, statistics, mathematics, or a related field Strong analytical and problem-solving skillsProficiency in Python, SQL, and data visualization tools Knowledge of machine learning techniques and their applications in fintechExcellent communication and collaboration skillsAbility to work independently and manage multiple projects simultaneouslyBenefitsTime off - We would love you to take time off to rest and rejuvenate. We offer flexible paid vacations as well as many other observed holidays by country. We also like to have our people take a day off for special days like birthdays and work anniversaries. Flexible Working - We believe in giving back the control of work & life to our people. We trust our people and love to provide the space to accommodate each and everyone's working style and personal life. Medical Benefits - We offer health insurance coverage for our employees and dependents. Our people focus on our mission knowing we have their back for their loved ones too. Mental Health and Wellness - We understand that our team productivity is directly linked to our mental and physical health. Hence we have Wellness Wednesdays and we engage partners to provide well-being coaching. And we have our Great FSMK Workout sessions too to keep everyone healthy and fit!Tech Support - We provide a company laptop for our employees and the best possible support for the right equipment/tools to enable high productivity"
https://www.linkedin.com/jobs/view/3708236675,linkedin,Risk Data Analyst Intern,Great Giant Foods,,fulltime,2023-08-30,,,,,,0,Actively Hiring,,"Perform exploratory data analysis using VBA or other tools.Present interesting findings of business operations performance to support key business stakeholders to drive business and strategic decisions.Build self-serve and predictive data products such as dashboards and tables to reduce time to insightsMinimum QualificationsFinal year or graduated student majoring in Statistics or at least having experiences/projects in data analysisShould have practical experience in VBA, SQL or other related tools. Prior experience with applied statistics, and experimental designAble to tell a coherent data narrative using visualisation tools and able to set best practices in data visualisation to convey a data insight through impactful graphs.Proven ability to recognize business needs and ability to communicate with multiple stakeholders.Willing to work from office (WFO) in Sequis Tower, SCBD.Willing to have contract at least for 6 months."
https://www.linkedin.com/jobs/view/3742036122,linkedin,Collection Data Analyst (MIS),Akulaku Indonesia,,fulltime,2023-10-18,,,,,,0,Actively Hiring,,"ResponsibilitiesAssisting Manager to do daily, weekly, monthly activity related Collection ProcessAbility to focus on details and accuracy in information processing.Proficient in Microsoft Office and Google Sheet.Remain up to date with industry best practice in relation to Arrears and Collections activities.Maintain a detailed understanding of all Arrears and Collections related regulationAssisting manager on creating new SOP or improving the existing SOP, including input as of the latest regulation.RequirementsCandidate must possess at least Bachelor's/College Degree in Finance/Accountancy/Banking or equivalentExperience in Fintech, Multifinance, or Banking at least 3 years.Experience in Collection or Risk Management at least 3 yearsAble to operate SQL language is a plus point.Good verbal and written communication skills.Excellent analytical skills and an eye for detailsOutstanding leadership and managerial skills.Strong time and people management skills.Ability to work to strict deadlines"
https://www.linkedin.com/jobs/view/3718618949,linkedin,Data Analyst - Central Data Platform,Gojek,,fulltime,2023-10-25,,,,,,0,Actively Hiring,,"About The RoleThe role is Associate Data Analyst (DA) working within the Shared Consumer Platform (SCP) - Goto CDP (Customer Data Platform)teamTogether with 2 other DA teams, the scope is to serve Product, Business, and Data stakeholders in terms of providing data and analysis related to GoTo CDP attributes and finding potential areas that can be improved in terms of user personalization, category affinity, demographic, and any other data point across GoTo ecosystemThe challenge is that our team serves very dynamic and growing products and cross-collaboration with multiple teams across Operating Companies (Tokopedia, Gojek, GTF). This product is also expected to increase the cross pollination across the GoTo Platform, hence DA team need to understand not only Tokopedia data but also Gojek and GTF data as well.What You Will DoUnderstand Data & Analytics capabilities within Business Unit/ClusterWorking closely with Product (Feature, Functionality), Business (Campaign, Initiatives) and also Technology (Implementation)Understand and Analyze Transactional (Order Related), Behavioral (Event Tracking, Client Activity), and Demographic dataExplore Various Datasets to Generate Insights, Conclusions and RecommendationsProduce actionable Dashboards for Monitoring, Reporting that Automates Insight GenerationCreate concise and insightful analytical reports.Collaborate and synergize across with other data functions such as Data Engineering, Data Tracker, and Data Scientist teams within GoTo groupWhat You Will NeedSQL skills - familiar with query language to derive valuable insights from databases.Analytical skills - Able to break down problems into clear problem statements, objectives and solution steps.Writing skills - Able to translate data into insightful stories in the form of a clear and concise document or deck.Data Visualization Skill - Produce data visualization with a strong storytelling element using Tableau/Looker/PowerBI.Statistical Skill - Familiar with statistical concept and approach especially in descriptive statistics, hypothesis testing, and regression analysis, using R or Python.Team player with a positive attitude.Experience working in a related field for at least 2 years or more.About GoTo GroupGoTo Group is the largest digital ecosystem in Indonesia with its mission to “Empower Progress’ by offering technological infrastructure and solutions for everyone to access and thrive in the digital economy. The GoTo ecosystem consists of on-demand transportation services, e-commerce, food and grocery delivery, logistics and fulfillment, as well as financial and payment services through the Gojek, Tokopedia and GoTo Financial platforms.It is the first platform in Southeast Asia that hosts these crucial cases in a single ecosystem, capturing the majority of Indonesia’s vast consumer household.About GojekGojek is Southeast Asia’s leading on-demand platform and pioneer of the multi-service ecosystem with over 2.5 million driver partners across the regions offering a wide range of services such as transportation, food delivery, logistics and more. With its mission to create impact at scale, Gojek is committed to resolving consumer problems and raising standards of living by connecting consumers to the best providers of goods and services in the market.About GoTo FinancialGoTo Financial accelerates financial inclusion through its leading financial services and merchants solutions. Its consumer services include GoPay and GoPayLater and serve businesses of all sizes through Midtrans, Moka, GoBiz Plus, GoBiz, and Selly. With its trusted and inclusive ecosystem of products, GoTo Financial is open to new growth opportunities and aims to empower everyone to Make It Happen, Make It Together, Make It Last.About TokopediaTokopedia is an Indonesian technology company with a mission to democratize commerce through technology. It has been a driving force behind Indonesia's digital development since its foundation in 2009, with more than 99% of districts and empowered around 12 million merchants listed nationwide. With Nakama ranging all across Indonesia, Tokopedia aims to simplify the lives of many to #FindYourPurpose together.GoTo and its business units, including Gojek, Tokopedia, GoToFinancial and GoToLogistics (""GoTo"") only post job opportunities on our official channels on our respective company websites and on LinkedIn. GoTo is not liable for any job postings or job offers that did not originate from us. You should conduct your own due diligence to prevent being victims of any fake job scams, if they did not originate from GoTo's official recruitment channels."
https://www.linkedin.com/jobs/view/3752024844,linkedin,"Client Success Representative APAC (Remote, Contract)",INFUSEmedia,,contract,2023-11-01,,,,,,0,,,"OUR HIRING PROCESS:We will review your application against our job requirements. We do not employ machine learning technologies during this phase as we believe every human deserves attention from another human. We do not think machines can evaluate your application quite like our seasoned recruiting professionals—every person is unique. We promise to give your candidacy a fair and detailed assessment. We may then invite you to submit a video interview for the review of the hiring manager. This video interview is often followed by a test or short project that allows us to determine whether you will be a good fit for the team. At this point, we will invite you to interview with our hiring manager and/or the interview team. Please note: We do not conduct interviews via text message, Telegram, etc. and we never hire anyone into our organization without having met you face-to-face (or via Zoom). You will be invited to come to a live meeting or Zoom, where you will meet our INFUSEmedia team. From there on, it's decision time! If you are still excited to join INFUSE and we like you as much, we will have a conversation about your offer. We do not make offers without giving you the opportunity to speak with us live. After all, we consider our team members our family, and we want you to feel comfortable and welcomed. Are you passionate about marketing? Ready to dive into the world of demand generation? INFUSEmedia is one of the fastest growing lead generation companies! INFUSED with drive, innovation, and integrity,we craft demand solutions with precision to fuel our clients' pipelines, every time.We are always looking for bright, motivated people to join our team. Apply now and tap into INFUSEmedia's growth!The Client Success Representative APAC (Remote, Contract) is responsible for developing customer relationships that promote retention and loyalty. Works closely with customers to ensure that they are satisfied with the services they receive and to improve upon areas of dissatisfaction.Responsibilities And DutiesDevelop and maintain relationships with a select group of named accounts to ensure campaign successServe as a trusted advisor for our clients and be an expert in INFUSEmedia offeringsCollaborate with internal subject matter experts to deliver campaign leads and ensure clients are happy with the outcomeCollaborate with the Sales team from proposal to delivery, including identifying and ensuring delivery options, integrations, and other operational aspectsCreate and coordinate account documentation including reports, RFPs, and other recommendationsAccountable for post-sale account management and driving account growth through excellent customer service and delivery, communication and on-boardingQualificationsMinimum two years of account management and/or customer success/service experience preferredOrganized, detail-oriented, and able to manage 30+ clients at onceDemonstrated ability to work both collaboratively as part of a team and independently with minimal supervisionStrong problem resolution skills and proven ability to engage and interact with internal teams to resolve client issuesWork logically to diagnose and resolve basic to intermediate issues and recognize circumstances that require escalationComfortable using and learning software: MS Office (Excel), custom-built software, CRM, ticketing/tracking systems, etc. Outstanding written and verbal communication skills, coupled with strong empathy for customers and their success"
https://www.linkedin.com/jobs/view/3759897784,linkedin,(Fintech) Risk Data Analyst - SQL Python,MatchaTalent,,fulltime,,,,,,,0,Be an early applicant,,"About the Company:Our client is a leading banking and digital finance platform in Southeast Asia that operates in 4 major countries: Indonesia, Philippines, Vietnam and Malaysia. Targeting an emerging market with an underserved but creditworthy and fast-growing consumer group, This Company currently provides users with digital banking, consumer credit, digital investment and insurance brokerage services, fulfilling financial needs for a wide range of customers.Just now, This Company has raised a total of $438.1M in funding over 10 rounds. Their latest funding was raised on Feb 15, 2022 from a Series E round. Are you an experienced professional with a knack for risk analysis in the financial services industry? Our Comprehensive Risk division is looking for a detail-oriented and analytical Risk Management Analyst to enhance our team's capabilities in managing and mitigating risk through data-driven insights. Job Description: Collaborating with insurance organizations and coordinating with external audit processes related to Expected Credit Loss (ECL).Ensuring the integrity and accuracy of insurance data through meticulous sending and verification processes.Handling both routine and complex data processing tasks with a high level of precision.Collecting, cleansing, and preprocessing data from diverse sources to guarantee its accuracy and completeness for analysis.Utilizing advanced statistical methods and data visualization tools to analyze and interpret large datasets, with the aim of pinpointing potential risks and discerning notable trends.Diligently monitoring and tracking key risk indicators (KRIs) and key performance indicators (KPIs) to spot emerging risks and trends in a timely fashion.Crafting detailed reports and presentations that effectively communicate the findings of risk analyses to stakeholders across the organization. Requirements: A minimum of 4 years of relevant work experience in the Financial Services or Banking industry.Strong proficiency in English, both written and spoken, to articulate complex analyses with clarity.Demonstrated proficiency in SQL and Python, showcasing your ability to handle data with expertise."
