job_url,site,title,company,location,job_type,date_posted,interval,min_amount,max_amount,currency,is_remote,num_urgent_words,benefits,emails,description
https://www.linkedin.com/jobs/view/3744790962,linkedin,Data Scientist Intern,Amartha,,internship,2023-10-20,,,,,,0,,,"Amartha is an emerging startup based in Indonesia that operates within the P2P lending domain, specializing in providing productive loans to rural women engaged in MSME/SME ventures. With a company culture that values fun, a growth-oriented mindset, innovation, and hard work, Amartha is dedicated to bridging the financial gap for its niche user segment, thereby fostering economic development in the region's most underserved communities.We are on the lookout for a dynamic Data Scientist Intern to join our team. The selected individual will programmatically extract both structured and unstructured data from diverse sources and craft in-depth analytics reports to address business challenges. Collaboration is key; the intern will work hand-in-hand with business stakeholders, engineers, and product managers. Candidates should have experience in database querying, be familiar with scripting languages like Python or R, and possess the ability to liaise effectively with both technical and non-technical users.Responsibilities:Complete ad-hoc data requests for business stakeholdersWrite SQL queries to extract data based on user requestsCreate effective data visualizations to present insights from data succinctlyDesign and develop dashboards to monitor critical business metricsMeet with users to clarify ambiguous business problems and propose concrete data solutionsRequirementsA Bachelor’s or Master's degree in engineering or quantitative fieldsExperience in extracting data from databases using SQL queriesSkill in presenting data insights through effective data visualizationsAbility to simplify and communicate complex concepts clearly to non-technical individualsStrong problem-solving skillsResilience when facing uncertainties and new challengesAbility to maintain clarity of thought under pressureA growth mindset"
https://www.linkedin.com/jobs/view/3751279685,linkedin,Junior Data Analyst,Enveritas,,fulltime,2023-11-06,,,,,,0,Actively Hiring,"jobs@enveritas.org, jobs@enveritas.org","Enveritas offers a new approach to sustainability assurance for companies and farmers. We are building sustainability solutions for smallholder coffee farming communities that are currently beyond the reach of existing certification and verification approaches.At Enveritas, we have developed a rigorous, scalable, and transparent verification method. This verification is the backbone of our Responsible Sourcing platform that helps companies meet their sustainability targets by investing in the areas that need it most.Enveritas is a startup non-profit focused on helping 100 million people out of poverty by 2030. Founded in 2016 and fast-growing, Enveritas now operates in 26 countries and provides sustainability verification free of charge for smallholder farmers. Using leading-edge AI, Enveritas has developed innovative approaches to monitor deforestation and calculate carbon footprints in the supply chains of multinational firms.The Junior Data Analyst (JDA) will be managing, analyzing, and cleaning data on a real-time basis, providing feedback to field teams, and collaborating with members of the Enveritas’ Asia team and global team. The JDA will also perform ad-hoc data analysis to monitor the quality of surveys and help manage and coordinate field team logistics. This person will mainly help operational work in Asia (including Papua New Guinea) and can generate and execute on new opportunities in the region.This position is remote but the ideal candidate will be based Southeast and South Asia (Preferably Indonesia, India, Thailand, Vietnam, Laos, Papua New Guinea)The Enveritas team includes 8 persons based in Asia and about 90 members globally; our team is made up of program & field operations managers, data scientists, product managers, software engineers, agronomy and coffee industry experts, and multi-generational coffee farmers. This person will report to the Operations Manager, as well as various global members of the Asia Data & Insights team.This position will have the backing of a global team with deep experience in coffee sustainability and technology to help you reach your goals. Enveritas offers a fun, open environment with exciting new work, the opportunity to gain technological skills, and the opportunity to travel across coffee regions.What You'll Do in This Role:Lead the day-to-day end-to-end data quality process in multiple countries in Southeast Asia: Generate daily quality control reports from survey data by running analyses Follow up with field teams to receive returned daily and weekly quality control reports; communicate with teams to correct mistakes and improve quality of data Monitor quality of data collected on a daily basis and report results to Data and Insights managers Identify survey or logistical issues during survey collection and brainstorm ways to solve them Support the set up and implementation of training sessions and create retraining documentsSupport data analysis during SUCO and WACOTest and help to design Data Quality tools and survey questionnaires using smartphonesSupport customization of smallholder, mill/estate and backcheck surveys for the countrySupport the process of insights generation in Southeast Asia and support other teams in Southeast Asia:Conduct data analysis projects to improve Enveritas’ understanding of coffee industry dynamics in Southeast AsiaConduct research related to coffee in several countries in Southeast AsiaIn tandem with Enveritas’ Operations team, research and engage with stakeholders in the region to increase the impact of Enveritas’ data collection activitiesSupport Asia Operations in select activities:Conduct training of enumerator teamsTake part in the coordination of the work of field survey teams alongside the Operation Manager; this includes travel about 10% of the yearSupport the Asia Data & Insights team and Operations team on special projects and ad hoc requestsParticipate in the training of Field Coordinators and enumerators; lead sessions on Data QualityTrain Enveritas field ops team on new survey and data quality tools, as they are releasedOther duties as assignedWe feel the successful candidate for the Junior Data Analyst role at Enveritas will have demonstrated experience and success in the following areas: Education: Bachelor degree in the field of development studies, statistics, plant science, agriculture, community development, environmental development, agribusiness, or other relevant disciplines.Experience: 1+years experience in agriculture sectors (having experience in coffee industry is highly desirable)Other soft skills: flexible problem-solving attitude, clear track record of working in a fast-paced, multicultural environmentLanguages: Fluency in English and at least speaking one of these local languages (Kannada, Malayalam, Telugu or Tamil)Attitudes: Strong work ethic and professionalism, particularly when doing independent and remote work, eagerness to learn, careful and highly responsible personData driven: Experience managing and conducting quantitative and qualitative research with strong data quality management knowledge is highly desirable Detail oriented: Puts high attention on details and helps teams to improve quality of the dataComputer skills: Including proficiency in Microsoft Office and Google Docs applications, familiarity with quantitative data collection software/platforms; knowledge of programming languages (Python) and geographic information systems (GIS) applications such as QGIS, Google Earth - would be beneficial, but not requiredExperience with coffee farming highly advantageous (raised in coffee growing families, participated in research conducted on coffee)Experience with research and data collection processes is highly beneficialFull-time availability and willingness to work during non-business hours, including weekends if neededExpect :50% travel during the peak verification season (Nov - May)Application Process - steps typically include:Submission of application (rolling)A technical test completed remotely Role alignment interview; an opportunity to learn if this position is a mutually good fitFinal interview (with East Africa Operations Manager and/or Data and Insights Manager)We recognize that people come with a wealth of experience and talent beyond what we list as qualifications. Your life experiences help build core competencies and knowledge that may be transferable to our openings. Therefore, we encourage people from all backgrounds to apply to our positions.Our work is complex and nuanced, so the more diversity we have in the voices working on our problems, the larger of an impact our work can have for the world. Enveritas is an Equal Opportunity Employer encouraging an inclusive and diverse workforce. We embrace and celebrate the unique experiences, perspectives, and cultural backgrounds that each individual brings to the workplace.Feel free to contact us at jobs@enveritas.org should you have any questions about the position or the interview process. Questions about this opportunity or process will not reflect negatively on your application.Enveritas has been made aware of fake job postings by individuals pretending to hire persons seeking employment. These individuals are looking to collect personal information about you for the purpose of perpetrating fraud or stealing your identity.All legitimate Enveritas job openings are posted on the Enveritas Lever board at https://jobs.lever.co/Enveritas. All recruiting emails from Enveritas team members will come through Lever or from @enveritas.org.If you have any concerns about employment opportunities or contact from someone supposedly representing Enveritas, please reach out to us at jobs@enveritas.org."
https://www.linkedin.com/jobs/view/3736055426,linkedin,Data Analyst (intern),Kawan Lama Group,,fulltime,2023-10-11,,,,,,0,Actively Hiring,,"Gambaran PekerjaanSebagai Data Analyst (Intern), Anda bertugas untuk mengumpulkan, mengolah, dan menyajikan informasi terkait data pelanggan sehingga menjadi rekomendasi bagi tim terkait yaitu tim loyalty program business unit untuk mendukung tercapainya loyalty program yang efektif dan efisien.Kualifikasi Mahasiswa jurusan Manajemen Informatika/Statistik/Marketing. Skill yang Dibutuhkan R Studio Python Google Data Studio AWS Presentation skill"
https://www.linkedin.com/jobs/view/3756549671,linkedin,Research & Insight Intern - Business Intelligence,Shopee,"Jakarta, Indonesia",internship,2023-11-02,,,,,,0,Actively Hiring,,"Job DescriptionRecruit users for user interview purpose depending on the research projectsNote taking during user interviewHelp manage user interview schedule and other operational tasksHelp doing desk research when necessaryRequirementsLast year of university students, or fresh graduates from social-science major (psychology, sociology, anthropology, economics, etc.) with decent comprehension of the major/subjectsComfortable with talking to a lot of peopleUnderstand basic use of excel, words, powerpoints, and emailGood command of English"
https://www.linkedin.com/jobs/view/3701106727,linkedin,Data Scientist,StickEarn,,fulltime,2023-08-22,,,,,,0,,,"Job DescriptionLead the end-to-end data science lifecycle, from problem definition and data collection to model development and deployment.Primarily focus on data science techniques which utilize ML, predictive modeling, clustering, classification & optimization algorithms.Work closely with internal and external stakeholders to understand business objectives and translate them into working solutions.Collaborate with data engineers to preprocess and transform raw data into a suitable format for insights and decision makingEvaluate and validate model performance using appropriate metrics and ensure their scalability and robustness.Communicate complex findings and results to both technical and non-technical audiences Job RequirementsBachelor's degree in Computer Science, Electrical Engineering or a related field is desirable2+ years of experience operating as a Data ScientistProficiency in Python/R, SQL & Data visualization tools (Tableau, etc)Strong understanding of data preprocessing, feature selection and model evaluation.Fluency in both Bahasa & English languagesExcellent communication skills."
https://www.linkedin.com/jobs/view/3620266146,linkedin,Data Science & Analytics,Artsy,,,2023-05-08,,,,,,,,,
https://www.linkedin.com/jobs/view/3737317871,linkedin,Internship for Research and Development (RnD),PT. Sasa Inti,,internship,2023-10-13,,,,,,0,,,"DESKRIPSI PEKERJAANBelajar dan membantu dalam proyek yang berkaitan dengan Research and Development, me-redesigning existing product, melakukan uji panel prototype produk.Membantu mengawasi proses pembuatan produk, berkolaborasi dengan divisi lain dalam menjalankan sebuah proyek, melakukan riset terkait dengan produk.Belajar dan mendukung kegiatan serta proyek lain yang terkait dengan RnD."
https://www.linkedin.com/jobs/view/3754698292,linkedin,Data Analyst (Remote),"Love, Bonito",,,2023-10-05,,,,,,,,,
https://www.linkedin.com/jobs/view/3736053971,linkedin,Data Engineer (intern),Kawan Lama Group,,fulltime,2023-10-11,,,,,,0,Actively Hiring,,"Gambaran PekerjaanSebagai Data Engineer (Intern), Anda bertugas untuk mengumpulkan, mengolah, dan menyajikan informasi terkait data pelanggan sehingga menjadi rekomendasi bagi tim terkait yaitu tim loyalty program business unit untuk mendukung tercapainya loyalty program yang efektif dan efisien.Kualifikasi Mahasiswa jurusan Manajemen Informatika/Statistik/Marketing. Skill yang DibutuhkanR StudioPythonGoogle Data StudioAWSPresentation skill"
https://www.linkedin.com/jobs/view/3758084424,linkedin,Fraud Analytics,Shopee,"Jakarta, Indonesia",fulltime,2023-11-04,,,,,,0,Actively Hiring,,"Job DescriptionDetect/identify fraudulent behaviors within the platform and formulate the most effective strategy to mitigate/prevent themDeep-dive issues and define valuable & implementable action items to solve the issueCreate and monitor fraud metrics dashboard and report regularly to management by creating detailed decks of metrics trends, fraud cases, and fraud initiativesIdentify opportunities for automation and optimization for various BAU processesCreate, maintain, or enhance business processes/SOP to mitigate fraudProactively initiate ideas through collaborating with cross-functional teams (both local and multinational) to mitigate fraud.RequirementsStrong problem-solving skills, structured thinking, analytical skills, and enjoy working with numbersMinimum 2 years of similar working experience, with analytical, statistical, and data modeling are preferablePrior working experience in consultant or startup industries is strongly preferredCurious to deep-dive anomaly or suspicious data and able to generate insights/findings from data to make data-driven decisionsSQL and spreadsheet proficiency is a must; R/Python programming language is a plusStrong stakeholder management & communication skills (Fluent in ID and EN, both written and verbal)Agile, comfortable working in fast-paced environments and managing multiple projects."
https://www.linkedin.com/jobs/view/3731994097,linkedin,Research Intern,PT Bank Jago Tbk,,internship,2023-09-19,,,,,,0,Actively Hiring,,"What you will do: Work closely with the Customer Listening Squad to assist the research: help conduct the fieldwork, be adaptive to team needs and participant needs. Assist and practice observation and synthesizing the data, draft the report, and pulling out insights. Assist in telling compelling stories through research findings, help make meaning for business stakeholders, and help drive action. What you need to have: Interest in either UX research or market research. Do note that while you may be leaning towards one, you will be exposed to both Have experience in quantitative method and comfortable with excel Strong willingness to learn, have characters of a self-starter with strong sense of curiosity Demonstrate potential for good critical thinking and problem-solving skills Preferably undergraduate from any majors with no class to attend No particular degree or past education related to the field is necessary; as long as you are curious and passionate about the subject, we'd love to hear from you!"
https://www.linkedin.com/jobs/view/3639482490,linkedin,"ML Engineer, NLP (US-based Firm)",Michael Page,"Bali, Indonesia",fulltime,2023-06-23,,,,,,0,Actively Hiring,,"Chance to work closely with C-levels/founders|Bali-based for a year, remote working afterwardAbout Our ClientClient is a US-based investment firm expanding in Indonesia.Job DescriptionWorking collaboratively with our team to drive capability enhancement and automation, identify uses of AI and figure out ways algorithms can make workflows more efficient.Data Analysis and Modeling: Collaborate with investment professionals to identify and define key investment problems and develop data-driven solutions. Apply statistical modeling, machine learning techniques, and advanced algorithms to extract insights from diverse datasets and generate investment signals.Machine Learning Development: Design, develop, and implement scalable machine learning systems that analyze large volumes of financial data, market trends, and alternative data sources. Build predictive models, anomaly detection algorithms, and portfolio optimization tools to support investment strategies and risk management.Natural Language Processing (NLP): Utilize NLP techniques to process and analyze unstructured textual data from various sources such as news articles, financial reports, and other media.Develop sentiment analysis, topic modeling, and text classification models to extract valuable insights for investment decision-making.Prompt Engineering: Drafting, refining, and testing text prompts to make sure they are yielding the desired outcome. Integrating AI into our workflows efficiently. Optimizing text prompts based on feedback from our specialists.Model Evaluation and Enhancement: Evaluate the performance and effectiveness of developed models, identify areas for improvement, and fine-tune models to enhance accuracy, robustness, and speed. Conduct backtesting and simulation analysis to assess model performance and refine investment strategies.Data Engineering and Integration: Collaborate with data engineers and architects to design and implement efficient data pipelines, ensuring the availability, integrity, and quality of data.Explore and integrate external datasets to augment internal research capabilities.Collaboration and Communication: Work closely with our CTO/CIA, investment team, and other stakeholders to understand business requirements, communicate findings, and contribute to the fund's investment research process. Collaborate in cross-functional teams to deliver innovative solutions and support investment decision-making.Stay Current with Industry Trends: Keep abreast of the latest developments, research, and emerging trends in data science, machine learning, and NLP within the financial industry. Apply new methodologies, tools, and technologies to drive continuous improvement and innovation in our research processes.The Successful ApplicantAn advanced degree in a quantitative field such as Computer Science, Data Science, Statistics,Artificial Intelligence, Machine Learning, Mathematics, or a related discipline. Demonstrated exceptional academic performance as evidenced by being in the top 20% of graduates, and/or possess an outstanding university transcript reflecting consistently high grades and a strong academic record.Solid experience (1-3 years) in developing and implementing machine learning models and algorithms in a professional setting, preferably within the financial industry.Strong proficiency in programming languages such as Python or R, with expertise in relevant libraries and frameworks for data analysis, machine learning, and NLP (e.g., ChatGPT, TensorFlow, PyTorch, Scikit-learn, NLTK)Demonstrated expertise in applying statistical modeling, machine learning, and NLP techniques to real-world problems, with a track record of delivering actionable insights and tangible results.Experience with financial data, market data, and related technologies such as time series analysis, portfolio optimization, or alternative data integration is highly desirable.Familiarity with cloud platforms (in particular AWS or Azure) and distributed computing frameworks is a plus.Strong problem-solving skills, critical thinking abilities, and attention to detail.Effective communication skills, with the ability to present complex technical concepts to non-technical stakeholders.Ability to work in a dynamic and fast-paced environment, multitask, and meet deadlines.What's on OfferChance to work closely with C-levels/foundersBali-based for a year, remote working afterwardGreat opportunity for investment/trading enthusiastsContact: Clairine LontengQuote job ref: JN-062023-6091076"
https://www.linkedin.com/jobs/view/3747672007,linkedin,Junior Data Analyst,Jiva,,contract,2023-10-24,,,,,,0,,,"General OverviewEvaluate and analyze potential suppliers, and prepare monthly sales and supply cost reports to be submitted to direct supervisor. This position will report to the Senior Procurement Analyst.Roles And ResponsibilitiesResponsible for understanding the needs of their employer, and then communicating said needs with potential vendors. This is an integral part in choosing the best vendors.Recording incoming and outgoing goods from each supplierMake daily, weekly, monthly reports on incoming and outgoing goods from each supplierRecording the amount of billing payments received by the companyMake daily, weekly and monthly reports on sales and supply costsreceive goods, as well as bill payments and make transactions with vendors or suppliers.Make a request for payment approval to the direct supervisorCoordinate with finance related to supplier payment schedulesWork closely with the Warehouse in controlling the amount of inventory and checking goods.Conduct regular visits to suppliers to reconcile dataEvaluate and analyze potential suppliers and then provide advice/advice to direct superiorsResponsible for documenting the costs for all vendors, as well as generating monthly cost reports to present to stakeholders. They are also responsible for documenting the communication cycle with potential vendor leadsRequirementsMinimum experience in Procurement Analyst, Data Analyst, Sales Support Analyst, Purchasing Analyst, Merchandising Analyst at least 1 years in Agriculture, FMCG, RetailFresh Graduates are welcomeExperience in managing thousand rows of numbers in excelAdvance in Microsoft Excel skillExceed in the analytical skillGood communication skill both writing and verbal in Indonesia and English will be advantageWill be placement at Semarang"
https://www.linkedin.com/jobs/view/3720792861,linkedin,Sr. Data Scientist,Nikel,,,2023-09-19,,,,,,,,,
https://www.linkedin.com/jobs/view/3667179367,linkedin,Expression of Interest: Data Scientist,Fingerprint for Success (F4S),,,2023-06-22,,,,,,,,,
https://www.linkedin.com/jobs/view/3758779502,linkedin,Data Analyst,Kawan Lama Group,,fulltime,,,,,,,0,Actively Hiring,,"As a Data Analyst, your duty is to collect, process and present information related to customer data so that it becomes a recommendation for the relevant team, namely the business unit loyalty program team to support the achievement of an effective and efficient loyalty program.Job Responsibilities:Provide data to all stakeholders.Develop clear and well-structured analytical plans and relevant analysis for acquisition, engagement, and retention for new and existing members.Design and develop dashboard for reporting mechanism to enable business performance monitoring and influence data-driven decision.Import, clean, transform, validate, and modeling data (with R, SQL, Python, or other programming language) to have in-depth understanding of the data and driving conclusions for business and product related decision making.Write SQL scripts to run and create reports from Data Warehouse.Job Requirements:Minimum 1 year experience as a Data Analyst or Business Analyst (preferably in retail industry).Mastery of SQL and experienced in BI reporting.Good communication and strong critical thinking.Independent problem solving skill and statistical analysis techniques."
https://www.linkedin.com/jobs/view/3742035145,linkedin,Junior Data Analyst,JULO,,,2023-10-18,,,,,,,Actively Hiring,,
https://www.linkedin.com/jobs/view/3695201730,linkedin,Machine Learning Engineer (MLE),NRI (Nomura Research Institute),,,2023-08-16,,,,,,,,,
https://www.linkedin.com/jobs/view/3749827466,linkedin,"Machine Learning Specialist (remote, based in Indonesia/APAC)",Revalue Nature,,,2023-11-03,,,,,,,,,
https://www.linkedin.com/jobs/view/3751734195,linkedin,Computer Vision Engineer,KECILIN,,,2023-10-18,,,,,,,Be an early applicant,,
https://www.linkedin.com/jobs/view/3752392215,linkedin,Data Science Manager,AXA Mandiri Financial Services,,,,,,,,,,Be an early applicant,,
