job_url,site,title,company,location,job_type,date_posted,interval,min_amount,max_amount,currency,is_remote,num_urgent_words,benefits,emails,description
https://www.linkedin.com/jobs/view/3550238431,linkedin,Network Security Engineer,NTT Ltd.,"Jakarta, Indonesia",contract,2023-10-18,,,,,,0,Actively Hiring,,"Key Roles and Responsibilities:Ensure that assigned infrastructure at the client site is configured, installed, tested, and operationalPerform necessary checks, apply monitoring tools and respond to alertsIdentify problems and errors prior to or when it occurs and log all such incidents in a timely manner with the required level of detailAssist in analyzing, assigning, and escalating support callsInvestigate third line support calls assigned and identify the root cause of incidents and problemsReport and escalate issues to 3rd party vendors if necessaryProvide onsite technical support to clients and provide field engineering services to clientsConduct a monthly random review of incidents and service requests, analyze and recommend improvement in qualityProvide continuous feedback to clients and affected parties and update all systems and/or portals as prescribed by NTTProactively identify opportunities for work optimization including opportunities for automation of workCertificates QualificationsAdvanced diploma, degree, or relevant qualification in IT/Computing (or demonstrated equivalent work experience)Minimum cert - NSE 3Required Experience:Minimum 2 years of experience with FirewallDemonstrated experience of Managed ServicesDemonstrated experience working with vendors and/or 3rd parties"
https://www.linkedin.com/jobs/view/3731579125,linkedin,Network Engineer - Jakarta,PT. Varnion Technology Semesta,,fulltime,2023-10-11,,,,,,0,Actively Hiring,,Company Description: Job Description: Technical support client. Standby shifting. Installation networking hardware. Handling troubleshoot/problem solving network/infrastructure.
https://www.linkedin.com/jobs/view/3716447699,linkedin,Senior Network Engineer- Regional Corporate IT,Lazada,"Jakarta, Indonesia",,2023-10-12,,,,,,,Actively Hiring,,
https://www.linkedin.com/jobs/view/3731573849,linkedin,Network Engineer - Bali,PT. Varnion Technology Semesta,,,2023-10-11,,,,,,,Actively Hiring,,
https://www.linkedin.com/jobs/view/3711611642,linkedin,Network Security Engineer (L1),NTT Ltd.,"Jakarta, Indonesia",,2023-09-27,,,,,,,Actively Hiring,,
https://www.linkedin.com/jobs/view/3653954347,linkedin,Technical Support Engineer,Samsung Electronics Southeast Asia & Oceania,,fulltime,2023-06-08,,,,,,0,Actively Hiring,,"Position Summary Promote all kinds of necessary service plans by managing all the processes that customers experience. Solve quality problems at an early stages and minimize the loss through technical support when quality issues occur to customers. Secure the level of quality for customers by carrying out quality collaboration with customers.Role And Responsibilities Technical support and verification process management for Samsung product Technical support related to the development of a Web App with the Tizen Platform for each global partner Analyzing and reviewing defect Create and review documents and report Deployment supportRequirementSkills and Qualifications Fluent in English Good communication Skills Good analitycal skill Experience with Javascript & Tizen development is preferred Samsung has a strict policy on trade secrets. In applying to Samsung and progressing through the recruitment process, you must not disclose any trade secrets of a current or previous employer. Please visit Samsung membership to see Privacy Policy, which defaults according to your location. You can change Country/Language at the bottom of the page. If you are European Economic Resident, please click here."
https://www.linkedin.com/jobs/view/3742038033,linkedin,Managed Service Network Engineer,PT Sinergy Informasi Pratama,,,2023-10-18,,,,,,,,,
https://www.linkedin.com/jobs/view/3729467138,linkedin,Network Administrator (Cikarang),EdgeConneX,,fulltime,2023-09-11,,,,,,0,,,"The Network Administrator reports to the Sr. Director, Strategic Analytics and is a member of the Office of Information Technology. The candidate will assist the team members with support, maintenance, and optimization of core network services, devices, and communications systems. The candidate will work alongside the senior infrastructure team members to provide logistical support, respond to queries, document changes, and assist with testing, assessment, diagnosis, and resolution of network service outages and incidents. The Network Administrator will be the primary point of contact for the Network Team in Southeast Asia. Working with the US and European IT Teams, this user will help align IT processes and standards for the region. Under the direct supervision of the Sr. Director, Strategic Analytics, the candidate will maintain network systems and may configure devices, enable services or respond to end-user requests for network status information. The candidate may have the opportunity to join the Sr. Director, Strategic Analytics in participating in informal and formal network learning opportunities and is expected to support the APAC region as a whole.Primary ResponsibilitiesResponsible for local network infrastructure and related equipment.Update/create all required documentation and align with business processes and policies.Respond and fix network and endpoint-related issues and reduce downtime and delays.Responsible for local network infrastructure & related equipmentAssist with management of Network Services by troubleshooting network issues, installing of new equipment, supporting phone systems, and other Network functions as needed.Maintain system configuration and standards for all network equipment.Assist with the operation and maintenance of the IT environment (Routers, Switches, Servers, Cabling, etc.)Install, administer, and test network servers, operating system software, printers, AV equipment, cabling, and other related network components/equipment.Configuration and management of Wireless LAN Controllers, Access Points, Switches and Routers (if needed)Maintain Microsoft 2008, 2012, and 2016 server operating systems.Create/Manage servers in VMWare virtualization environment utilizing VMWare VCenter.Update/create all required documentation and align with business processes and policiesAlign best practices in Southeast Asia with other global marketsUpdate and maintain the network documentation and change request forms.Uphold and keep current all network security standards and policies.Document and maintain network diagrams and schematics.Respond and fix network and endpoint-related issues and reduce downtime and delaysAssist users on-site and in-region with network-related issues.Provide assistance to other IT staff for maintaining SLAs and uptime.Troubleshoot Asterisk-based call routing and provider issues.Ensure network accessibility to all employees and remote support staff.Respond to Network escalations emanating from our Managed Service Providers (MSP).Provide guidance to network users during responses to emergency work requests; troubleshoots network failures and errors; and diagnoses, isolates, and resolves routine network related problems ensuring timely results and minimal disruption of operations.Assist users with hands-on IT support for their devices as neededPerforms other related job duties as assigned.Knowledge, Skills & AbilitiesWorking knowledge of computer systems, peripherals, and communications equipment.Working knowledge of computer networking and cabling infrastructure, including firewallsWorking knowledge of communication systems for data, voice, and video.Ability to work independently and in a team environment to resolve issues and meet deadlines.Effective verbal and written communications with team members and vendors.Experience with LAN switching (PVST+, 802.1q trunking, VLAN).Experience with (and/or certifications for) Cisco routers and switches.Experience/EducationFluent in English. Please submit your resume in English.Associate’s Degree or higher.3+ years of work experience in information technology in a role such as Jr. Network Administrator, IT Specialist, or related work field.EdgeConneX believes diversity – of thought, backgrounds and experiences – affects all that we do, from our employees to the solutions we deliver. Our goal is to create an environment in which inclusion through diversity helps deepen the lives and work experience of our employees, enhances our innovation and creativity, and enriches our involvement in our communities. EdgeConneX is an equal employment opportunity employer. All qualified applicants will receive consideration for employment without regard to race, color, religion, sex, age, national origin or ancestry, physical or mental disability, as well as any other category protected by applicable federal, state, or local laws.Powered by JazzHRT7RQPqX9cE"
https://www.linkedin.com/jobs/view/3733017965,linkedin,IT Network Engineer,NPAworldwide,,,2023-10-13,,,,,,,,,
https://www.linkedin.com/jobs/view/3703999784,linkedin,Senior Network Engineer,Traveloka,,fulltime,2023-08-25,,,,,,0,Actively Hiring,,"It's fun to work in a company where people truly BELIEVE in what they're doing!‎Job DescriptionSenior Network Engineer - Senior Network Engineer is an experienced role who has strong analytical and problem-solving capabilities in order to plan and execute network and security infrastructure technology. Their responsibilities include conducting assessment, planning, implementation, and development of network infrastructure (including routing switching devices, wireless, and cabling), IT budget and forecasting, analyzing network security performance and capacity to meet business needs, ensuring network monitoring and stability performance, network and security technology day to day operations, manage and coordinate project or problem with vendors or principles, managing and make sure all project running well. Senior Network Engineers must have excellent communication skills and problem-solving capabilities to help stakeholders from multiple backgrounds to provide solutions, project collaboration, and solve problems. This role will sit under IT Infrastructure Team and directly report to IT Infra Lead. She/ he will engage with various stakeholders in Traveloka for business projects.‎RequirementsEducational Background: Bachelor DegreeTechnical Skills: Have min 4 years of experience in the same field CCNP / CCIE certificate would be an advantage Have experience with routing switching devices (router, switch layer 2, and switch layer 3) Having experience with security devices technology will be an advantage (firewall, IPS, Radius, and VPN) Project & Resource Management (time management, resource allocation, communication management, and risk management) Documentation Management (writing and document classification) ITIL/ IT Service Management Framework (conceptual understanding) Good knowledge of data communication technologies: LAN, WAN, Internet Have knowledge of SOP (standard operating procedure) in terms of handling problems and maintaining daily operations. Have experience with wireless technology (access point, wireless controller, roaming, signaling, etc) Vendor Management (selecting vendors, negotiating contracts, controlling costs, reducing vendor-related risks, and ensuring service delivery) Have experience with cabling infrastructure projects.General Skills : Able to work in a technical team and within tight deadlines Communication (respectful, professional expression of thoughts/ ideas, well organized, and clear/ factual communication) Leadership (experience in conducting knowledge sharing/ training sessions, project management experience) Good level of written and oral communication in the English language. Fast and easy adapt to new technology‎If you like wild growth and working with happy, enthusiastic over-achievers, you'll enjoy your career with us!"
https://www.linkedin.com/jobs/view/3721305554,linkedin,"Service Provider Network Systems Engineer, Indonesia",Cisco,,,,,,,,,,Actively Hiring,,
https://www.linkedin.com/jobs/view/3735592997,linkedin,Security Engineer,Packet Systems Indonesia,,fulltime,2023-10-16,,,,,,0,Actively Hiring,,"Job Specification:Requirement:Hold a bachelor's degree (S-1 degree) in Information Technology Computer Engineering or Telecommunication from a reputable university with a minimum IPK of 3.0.Minimum 3 years of experience in security technology deployment/maintenanceHaving knowledge in Security technology such as Firewall and IPS (Checkpoint/PaloAlto/Cisco/Fortigate/McAfee)Having knowledge of Load Balance technology (F5)Having knowledge of Proxy Technology (Bluecoat)Having knowledge of Netscout technology.Having Professional Level Certification is a must (CCNP Security, PCNSE, NSE 7, etc.)Preferable having knowledge in Routing SwitchingPreferably having Vetscout certification.Excellent interpersonal & communication skillsCompetent with Microsoft Office applications i.e. Microsoft Visio, Word, Excel, and PowerPoint.Ability to perform under pressure and tight time constraints; work under limited guidance in line with a comprehensive plan, or strategy.Leadership, teamwork, commitment, and service excellence are personal qualitiesWilling to be positioned as resident engineer on customer site (Option)The role shall cover the following:For Project based:Support for a new installation, integration into the existing system, migration, and monitoring.Including all documentation related to the project (Site Survey, MoP, UAT, as build documentation).For Maintenance based:Support for troubleshooting problems in all PSI customers.Also, support for change requests in the customer network.Including reporting, documentation, and standby monitoring."
https://www.linkedin.com/jobs/view/3755445835,linkedin,Cyber Security Engineer,Gojek,,fulltime,2023-11-01,,,,,,0,Actively Hiring,,"About The RoleThe junior cyber security engineer is responsible for maintaining the GoTo corporate endpoint and network security posture to mitigate relevant security risks. On a day to day basis the role will work together with various security, IT and engineering teams in monitoring and maintaining security controls used to secure GoTo corporate endpoint and network, supporting the review and implement improvements to security controls, as well as supporting the remediation of relevant security issues.What You Will DoMonitor and maintain security controls that are used to secure GoTo corporate endpoint and network.Review and implement identified improvements to improve the security posture of GoTo corporate endpoint and network.Perform security hardening on GoTo corporate endpoint and network.Support remediation of relevant security issues relevant to GoTo corporate endpoint and network.Develop, review and improve technical documentation and reports relevant to the security controls used by GoTo corporate endpoint and network.What You Will NeedAt least 2 years of experience in cyber security, preferably with hands-on experience in implementation and/or maintenance of endpoint and network security solutions in a large corporate setting.Hands-on experience in the configuration, hardening and troubleshooting of endpoint and network security solutions, including firewalls, wifi security and EDR solutions.Coding and scripting skills especially for automation is desired.Networking and network security concepts and solutions, including but not limited to wifi security, firewall, IDS/IPS.OS and endpoint security concepts and solutions, including but not limited to EDR, OS vulnerability, endpoint management solutions.Language: Good proficiency both in written and spoken EnglishCommunication and documentation: Good ability to communicate and document technical concepts and ideas in a clear and concise manner.About The TeamThe Enterprise Security team is tight knit, dedicated and filled with strong minded individuals focused on securing GoTo systems and information used by GoTo internal corporate users. We encourage candid discussions in finding solutions for our challenges.About GoTo GroupGoTo Group is the largest digital ecosystem in Indonesia with its mission to “Empower Progress’ by offering technological infrastructure and solutions for everyone to access and thrive in the digital economy. The GoTo ecosystem consists of on-demand transportation services, e-commerce, food and grocery delivery, logistics and fulfillment, as well as financial and payment services through the Gojek, Tokopedia and GoTo Financial platforms.It is the first platform in Southeast Asia that hosts these crucial cases in a single ecosystem, capturing the majority of Indonesia’s vast consumer household.About GojekGojek is Southeast Asia’s leading on-demand platform and pioneer of the multi-service ecosystem with over 2.5 million driver partners across the regions offering a wide range of services such as transportation, food delivery, logistics and more. With its mission to create impact at scale, Gojek is committed to resolving consumer problems and raising standards of living by connecting consumers to the best providers of goods and services in the market.About GoTo FinancialGoTo Financial accelerates financial inclusion through its leading financial services and merchants solutions. Its consumer services include GoPay and GoPayLater and serve businesses of all sizes through Midtrans, Moka, GoBiz Plus, GoBiz, and Selly. With its trusted and inclusive ecosystem of products, GoTo Financial is open to new growth opportunities and aims to empower everyone to Make It Happen, Make It Together, Make It Last.About TokopediaTokopedia is an Indonesian technology company with a mission to democratize commerce through technology. It has been a driving force behind Indonesia's digital development since its foundation in 2009, with more than 99% of districts and empowered around 12 million merchants listed nationwide. With Nakama ranging all across Indonesia, Tokopedia aims to simplify the lives of many to #FindYourPurpose together.GoTo and its business units, including Gojek, Tokopedia, GoToFinancial and GoToLogistics (""GoTo"") only post job opportunities on our official channels on our respective company websites and on LinkedIn. GoTo is not liable for any job postings or job offers that did not originate from us. You should conduct your own due diligence to prevent being victims of any fake job scams, if they did not originate from GoTo's official recruitment channels."
https://www.linkedin.com/jobs/view/3755450501,linkedin,Information Security Engineer,Gojek,,fulltime,2023-11-01,,,,,,0,Actively Hiring,,"About The RoleThe Information Security Engineer will join the Security Architecture team and will be primarily responsible for performing security design reviews for various products/applications within the GoTo ecosystem. The Security Engineer will create the necessary security standards/guidelines for cryptography, secure design principles, third party integrations etc. The Security Engineer will work closely with the Engineering team in roll out of Secure SDLC processes and help in identifying the security issues as early as possible in the application development lifecycle. The Security Engineer will conduct the security workshops to Engineers and improve the security awareness among the Engineering community.What You Will DoPerform security design reviews for complex products/applications independentlyWork closely with Engineers in implementation of Secure SDLC processes to mitigate security threats as early as possible in the application development lifecycleAct as a primary contact for Engineering teams for any guidance/advice related to securityDefine and review security standards and best practices for areas related to data encryption, hashing, integration with partners, secure design principles etc.Develop secure coding guidelines for programming languages like Go lang, Java etcWork closely with other security teams in roll out of security initiatives and controlsDefining the requirements for security tooling primarily for SAST and DASTWhat You Will NeedAt least 6 years of experience in performing security design reviews, developing security standardsStrong knowledge of security frameworks and understanding of industry best practices and standards on secure product developmentMust have Knowledge of most common implementations of the threats in application security and how to remediate themFamiliar with the implementation details of security protocols like oAuth, OpenAPI, JWT etc. Decent level of coding experience to create secure coding guidelinesExperience with cloud platform such as AWS, GCP or AzureFamiliarity with the implementation of security tools primarily related to SAST and DAST activitiesPossess excellent verbal communication to interact with the team and stakeholders effectively and have good analytical abilities About The TeamThe Security Architecture is primarily responsible for ensuring the security controls are being considered by the Engineering teams right from the beginning of product/application development. This will help in reducing the attack surface and also significantly reduce the cost to mitigate any security issue that got detected during the later stages of application development. The security architecture team members will also get exposure on various technologies being used by the Engineering teams and develop necessary security standards/best practices. This will help the security architecture team members to be updated and relevant with various technologies.About GoTo GroupGoTo Group is the largest digital ecosystem in Indonesia with its mission to “Empower Progress’ by offering technological infrastructure and solutions for everyone to access and thrive in the digital economy. The GoTo ecosystem consists of on-demand transportation services, e-commerce, food and grocery delivery, logistics and fulfillment, as well as financial and payment services through the Gojek, Tokopedia and GoTo Financial platforms.It is the first platform in Southeast Asia that hosts these crucial cases in a single ecosystem, capturing the majority of Indonesia’s vast consumer household.About GojekGojek is Southeast Asia’s leading on-demand platform and pioneer of the multi-service ecosystem with over 2.5 million driver partners across the regions offering a wide range of services such as transportation, food delivery, logistics and more. With its mission to create impact at scale, Gojek is committed to resolving consumer problems and raising standards of living by connecting consumers to the best providers of goods and services in the market.About GoTo FinancialGoTo Financial accelerates financial inclusion through its leading financial services and merchants solutions. Its consumer services include GoPay and GoPayLater and serve businesses of all sizes through Midtrans, Moka, GoBiz Plus, GoBiz, and Selly. With its trusted and inclusive ecosystem of products, GoTo Financial is open to new growth opportunities and aims to empower everyone to Make It Happen, Make It Together, Make It Last.About TokopediaTokopedia is an Indonesian technology company with a mission to democratize commerce through technology. It has been a driving force behind Indonesia's digital development since its foundation in 2009, with more than 99% of districts and empowered around 12 million merchants listed nationwide. With Nakama ranging all across Indonesia, Tokopedia aims to simplify the lives of many to #FindYourPurpose together.GoTo and its business units, including Gojek, Tokopedia, GoToFinancial and GoToLogistics (""GoTo"") only post job opportunities on our official channels on our respective company websites and on LinkedIn. GoTo is not liable for any job postings or job offers that did not originate from us. You should conduct your own due diligence to prevent being victims of any fake job scams, if they did not originate from GoTo's official recruitment channels."
https://www.linkedin.com/jobs/view/3734926944,linkedin,Cyber Security Engineer,NawaData,,,2023-10-14,,,,,,,Be an early applicant,,
https://www.linkedin.com/jobs/view/3750675615,linkedin,Senior Network Engineer,PT Nusantara Compnet Integrator (Compnet),,fulltime,2023-10-31,,,,,,0,Actively Hiring,,"Candidate will be part of Project Implementation Team as a PIC or Team MemberAsessment Customer existing Condition for Project ImplementationPrepare and Create MOP or LLD or Design Document before ImplementationInstallation, Integration or Migration based on Design DocumentTroubleshooting and Reporting for network IssuesCreate Technical Closing Document.Coordination with Internal Team or Customer for Project ImplementationRequirements :Minimum Bachelor Degree (S1) in Informatics Engineering, Telecommunication Engineering, Computer Science, Electrical Engineering, or related Engineering disciplineMinimum 2 years experience as a Network Engineer or in related fieldHolding one of the following certification: CCNP Service Provider or CCNP Enterprise (Concentration Certificate on ENARSI) or JNCIP is a mustExperience and understanding about Software Define (ACI, SD-WAN, SD-Access) will be prioritizedExperience with troubleshooting, network diagnostic, monitoring and analysis toolsHaving knowledge and familiarity with Cisco Products (ex: ASR9K & ASR900 Families, NCS , Nexus, ISR, Catalyst)"
