job_url,site,title,company,location,job_type,date_posted,interval,min_amount,max_amount,currency,is_remote,num_urgent_words,benefits,emails,description
https://id.indeed.com/viewjob?jk=16bec6ff480cb081,indeed,Network Engineer,PT Dua Empat Tujuh,"Yogyakarta, YO, Indonesia",contract,2023-11-07,monthly,2850000,-1,IDR,False,0,,,"Dapat melakukan analisa, desain, dan implement network infrastructure. Bersedia lembur untuk maintenance network jika ada kendala (diluar jam kerja ataupun…"
https://id.indeed.com/viewjob?jk=a5fa0b965b4f2527,indeed,Network Engineer,Elabram Systems,"Jakarta, JK, Indonesia",contract,2023-09-18,monthly,4900000,5000000,IDR,False,0,,,"Mengetahui Topologi Jaringan, TCP/IP Network, IPv4."
https://id.indeed.com/viewjob?jk=ca1adefded16c027,indeed,Network Engineer,PT Jinom Network Indonesia,"Denpasar, BA, Indonesia",fulltime,2023-10-08,,,,,False,0,,,"Laki-laki maksimal usia 28 Tahun. Memiliki keahlian dalam mengkonfigurasi Mikrotik, Ubiquity, Cisco dan dapat mengoperasikan OS Windows, Linux, dan VM."
https://id.indeed.com/viewjob?jk=1c1e74d879dac9e0,indeed,Network Engineer,PT. Jasa Teknologi Informasi IBM,"Jakarta, JK, Indonesia",fulltime,2023-10-12,,,,,False,0,,,"Monitor network performance and troubleshoot issues, implementing proactive measures to optimize network performance and minimize downtime."
https://id.indeed.com/viewjob?jk=71cdcfb062c6e764,indeed,Wireless Engineer,Mitra Solusi Infokom,"Jakarta, JK, Indonesia",fulltime,2023-06-27,,,,,False,0,,,"Handling Second level support for technical issues on Wireless Network products. Installing, implementing, troubleshoot, problem solving for project and…"
https://id.indeed.com/viewjob?jk=abbf6ca6213c7af9,indeed,Staf Teknisi Komputer,PT Asia Teknologi Solusi (ATS Communication),"Jakarta, JK, Indonesia",fulltime,2023-05-26,monthly,5500000,7700000,IDR,False,0,,,Kami membutuhkan kandidat yang berpengalaman dalam bidang Jaringan Komputer sebagai layanan Managed Service kami ke pelanggan.
https://id.indeed.com/viewjob?jk=4b8a027b85f1f62f,indeed,Staf Teknisi,PT Asia Teknologi Solusi (ATS Communication),"Jakarta, JK, Indonesia",fulltime,2023-05-26,monthly,4500000,7500000,IDR,False,0,,,Kami membutuhkan kandidat yang berpengalaman dalam bidang Jaringan Komputer sebagai layanan Managed Service kami ke pelanggan.
https://id.indeed.com/viewjob?jk=1da2c1cf94eaf23f,indeed,Network Engineer,Compnet,"Jakarta, JK, Indonesia",,2021-09-20,,,,,False,0,,,Provide solutions and give recommendations to the customer according to their needs. Regularly visit the customer to check up their device.
https://id.indeed.com/viewjob?jk=47a86cbab67703f5,indeed,IT Systems Engineer,PT. Prodata Sistem Teknologi,"Jakarta, JK, Indonesia",fulltime,2023-10-24,monthly,4000000,7000000,IDR,False,0,,,"Good understanding basic & advanced network monitoring, security system & IT Service Management. Minimum S1 degree , preferred major in Engineering/Computer…"
https://id.indeed.com/viewjob?jk=cc835060a05c1ebb,indeed,Network Engineer,PT. Mitra Kerja Utama,"Banjarmasin, KS, Indonesia",fulltime,2023-10-31,monthly,2800000,3000000,IDR,False,0,,,"Lebih disukai berpengalaman sebagai Teknisi jaringan (fresh graduate dipersilakan melamar). Mengetahui fiber optik, troubleshoot, maintenance, dan lain-lain."
https://id.indeed.com/viewjob?jk=723fc8af1a12da77,indeed,Network Engineer,StrategArt,"Jakarta, JK, Indonesia",,2019-11-20,,,,,False,0,,,Responsible in defining network capacity planning. Minimum 3 years experiences in network implementation projects.
https://id.indeed.com/viewjob?jk=d3863201c9632b15,indeed,Network Engineer,PT. Mitra Kerja Utama,"Bandung, JB, Indonesia",fulltime,2023-10-26,monthly,3000000,4000000,IDR,False,0,,,"Lebih disukai berpengalaman sebagai Teknisi jaringan (fresh graduate dipersilakan melamar). Mengetahui fiber optik, troubleshoot, maintenance, dan lain-lain."
https://id.indeed.com/viewjob?jk=250993ba7aab0543,indeed,Network Engineer,JAVANDRA,"Jakarta, JK, Indonesia",,2023-09-05,,,,,False,0,,,Handling & Monitoring the implementation of PoC. Works with Supervisor or Project Manager to run PoC. Age Max. 25 years old. Job Type: Full Time Part Time.
https://id.indeed.com/viewjob?jk=d9ef3e93bc861e3b,indeed,Network Engineer,DE-CIX Management GmbH,"Jakarta, JK, Indonesia",fulltime,2023-09-18,,,,,False,0,,,Installation of network hardware and software. Experience in working on network equipment and data center environment.
https://id.indeed.com/viewjob?jk=897e84d2ecbee851,indeed,IT Engineer,PT. Rabik Bangun Pertiwi,"Gresik, JI, Indonesia",fulltime,2023-10-08,monthly,2000000,5000000,IDR,False,0,,,Profesional dan berpangalaman di jaringan FO dan internet lainnya atau. Fresh Graduate yang Mengerti Jaringan Internet.
https://id.indeed.com/viewjob?jk=8803a4423ae90d03,indeed,Network Engineer,GITS Indonesia,"Jakarta, JK, Indonesia",fulltime,2023-08-31,,,,,False,0,,,Coordinating computer network access and use. Replacing faulty network hardware components when required. Conferring with network users about solving existing…
https://id.indeed.com/viewjob?jk=5260dddff5049ac4,indeed,Network Engineer,Elabram,"Jakarta, JK, Indonesia",,2023-09-18,,,,,False,0,,,22 - 30 Year(s) old.
https://id.indeed.com/viewjob?jk=548bdf8c38048048,indeed,Network Engineer,Nagitec,"Depok, JB, Indonesia",,2022-08-02,,,,,False,0,,,"Responsible in designing and administering security system for organizational network. Responsibility for setting up, developing, and maintaining computer…"
https://id.indeed.com/viewjob?jk=1ffe83d7bd7b6fb5,indeed,Network Engineer,Graha Karya,"Jakarta, JK, Indonesia",,2022-09-14,,,,,False,0,,,At least 1-2 year(s) of working experience in the related field is required for this position. Fresh Graduate(s) are welcome to apply.
https://id.indeed.com/viewjob?jk=46dd2757bbf57898,indeed,Network Engineer,Langit Kreasi Solusindo,"Jakarta, JK, Indonesia",fulltime,2023-10-27,,,,,False,0,,,"Handling first level support for technical issues on Wireless products. Installing, implementing, troubleshoot, problem solving for project and supporting an…"
https://id.indeed.com/viewjob?jk=ee04c8cc4bb7d1f2,indeed,Network Engineer,Indocom Niaga,"Jakarta, JK, Indonesia",,2020-11-10,,,,,False,0,,,Expert in the design techniques as well as the corporate-scale network system implementation. Create Bill of Material and proposal of proposed solution.
https://id.indeed.com/viewjob?jk=bdbe759c69b28f76,indeed,Network Engineer,ICDX,"Jakarta, JK, Indonesia",fulltime,2023-06-12,,,,,False,0,,,"Plan, deploy and monitor IT solutions to ensure system hardening and network security. Review new solutions and improve the resilience of the current network…"
https://id.indeed.com/viewjob?jk=cd045db07284fd18,indeed,Network Engineer,Technosoft SEA Pte Ltd,"Jakarta, JK, Indonesia",,2022-12-22,,,,,False,0,,,Help user with hardware and software issue. Developing source code and customization of dynamics Microsoft software.
https://id.indeed.com/viewjob?jk=8805ce26a0601054,indeed,Network Engineer,Graha Karya,"Jakarta, JK, Indonesia",,2022-09-14,,,,,False,0,,,"At least 1-2 year(s) of working experience in the related field is required for this position. Strong IT skills, comfortable with computer based tools,…"
https://id.indeed.com/viewjob?jk=0cc1c3cbc26adbfa,indeed,Network Engineer,"MUFG Bank, Ltd., Jakarta Branch","Jakarta, JK, Indonesia",fulltime,2023-07-07,,,,,False,0,,,"Hands-on experience with monitoring, network diagnostic and network analytics tools. Proven hands-on network engineering experience."
https://id.indeed.com/viewjob?jk=194b884ff9d278c0,indeed,Network Engineer,Monotaro,"Jakarta, JK, Indonesia",,2023-07-24,,,,,False,0,,,"Understand hardware and network is preferable. Ensures any given tasks are reported on and resolved in a timely manner. OS - Linux(Ubuntu), Windows server."
https://id.indeed.com/viewjob?jk=bc890ff8f8a74708,indeed,System Engineer,Compnet,"Jakarta, JK, Indonesia",,2021-09-20,,,,,False,0,,,"Troubleshooting and Reporting for network Issues. Experience with troubleshooting, network diagnostic, monitoring and analysis tools."
https://id.indeed.com/viewjob?jk=108cd122d4e1454d,indeed,Senior Network Engineer,PT Berlian Sistem Informasi,"Jakarta, JK, Indonesia",fulltime,2022-07-27,,,,,False,0,,,"Execute network engineer activities such as installing & configuring various network devices and services (routers, switches, firewalls, load balancers, VPN,…"
https://id.indeed.com/viewjob?jk=616f1af09dbc2ce1,indeed,Network Engineer,Humana International,"Jakarta, JK, Indonesia",,2022-11-12,,,,,False,0,,,Bachelor Degree or Master Degree in Information Technology (IT) or Computer Science. Must have 5 years experience in IT Network Engineering.
https://id.indeed.com/viewjob?jk=7e82fa19c4c2c1f0,indeed,Network Engineer,PT. MUST,"Jakarta, JK, Indonesia",fulltime,2023-07-25,monthly,5000000,5500000,IDR,False,0,,,Pendidikan minimal S1 Elektro/Telekomunikasi/Teknologi Informasi. Memiliki kemampuan bahasa Inggris lisan maupun tulis.
https://id.indeed.com/viewjob?jk=13f83678dc7e0d47,indeed,Network Security Engineer,Wira Arta Telematika,"Jakarta, JK, Indonesia",,2022-08-11,,,,,False,0,,,"Responsible for operation of network security equipment including upgrade, patch, and monitoring. Installation, configuration, and maintenance of network…"
https://id.indeed.com/viewjob?jk=d8e2a4e2248e7b93,indeed,Network Engineer,Qtera Mandiri,"Jakarta, JK, Indonesia",,2018-11-01,,,,,False,0,,,"Melakukan implementasi, demo produk, dan kegiatan maintenance di customer. Membuat laporan hasil kerja (product demo, problem solving, dan lain-lain)."
https://id.indeed.com/viewjob?jk=171754fe304152d6,indeed,Python Developer,Permana Solutions,"Jakarta, JK, Indonesia","fulltime, contract",2023-10-26,monthly,8000000,15000000,IDR,False,0,,,"Strong knowledge of machine learning principles and techniques, including supervised and unsupervised learning, and neural networks."
https://id.indeed.com/viewjob?jk=e211eedf4f305b2c,indeed,Junior Network Engineer,Data Global Komukatama,"Jakarta, JK, Indonesia",,2020-07-03,,,,,False,0,,,"Create and maintain comprehensive documentation for all implemented networks. Identifies, diagnoses, and resolves network problems."
https://id.indeed.com/viewjob?jk=94b9a6608d85033c,indeed,System Engineer,PT Lawencon Internasional,"Jakarta, JK, Indonesia","fulltime, contract",2023-09-13,monthly,7000000,9000000,IDR,False,0,,,Have knowledge about network and security concepts and tuning techniques and system performance configuration. Provide technical direction to IT support staff.
https://id.indeed.com/viewjob?jk=139e7a3dd09445ae,indeed,Quality Assurance Engineer,BIPO Service Shanghai Limited,Indonesia,,2023-09-19,,,,,False,0,,,"Work with the software manager/engineers for the software issue debugging when. Have served 460,000+ headcounts and 3,300+ clients."
https://id.indeed.com/viewjob?jk=6239244d404ce448,indeed,Engineer,NTT Ltd.,"Jakarta, JK, Indonesia",,2023-03-11,,,,,False,0,,,Design computer security strategy and engineer comprehensive cybersecurity architecture. Install software that monitors systems and networks for security…
https://id.indeed.com/viewjob?jk=dae9c15c3bbb2648,indeed,Engineer,NTT Ltd.,"Jakarta, JK, Indonesia",,2023-07-09,,,,,False,0,,,The MS Engineer is responsible for providing a service to clients by proactively identifying and resolving technical incidents and problems.
https://id.indeed.com/viewjob?jk=0931f018a01fac75,indeed,IT Engineer,OTO Group,"Jakarta, JK, Indonesia",,2018-12-31,,,,,False,0,,,30 tahun* Pendidikan D3/S1 Teknik Informatika /Manajemen Informatika/Teknik Komputer* Menguasai AD Windows 2008-2012* Menguasai Messaging dan Proxy Server*…
https://id.indeed.com/viewjob?jk=6aa70dd2f3b742e3,indeed,Engineer,PT Nexcom Indonesia,"Jakarta, JK, Indonesia",fulltime,2023-08-29,monthly,4902000,-1,IDR,False,0,,,"Monitoring network and operation system. Coordinating technician when trouble shooting. Making reports after installing, dismantle, and troubleshooting."
https://www.linkedin.com/jobs/view/3695205214,linkedin,Network Engineer,PT. Astra Graphia Information Technology (AGIT),"Jakarta, Indonesia",fulltime,2023-08-16,,,,,,0,Actively Hiring,,"installastion of Network Device (Routing Switching, Wireless, SD-WAN, dan SD-DC)Optimization & Improvement at Project Delivery (Routing Switching, Wireless, SD-WAN, dan SD-DC)Manage as Project Manager for some customer.Make reporting 4DMinimum Qualifications Education: Bachelor Degree from reputable universitySkills:Mastering Network Routing Switching (Cisco, Huawei, HP, Aruba, Juniper)SD-WAN Technology Device (Fortigate, Silverpeak, Cisco)Data Center Facility devices (UPS, PAC, EMS, Basic Electrical)Self-motivated and takes accountability and ownership for work under minimum supervision.Preq. Knowledge: Have a good knowledge for fundamental networking areas. OSI Model, Data Link, Network, Transport and Application Layers, Switching & Routing, Load Balancing, Security and Application Delivery PlatformsExperience: 2-3 years experience"
https://www.linkedin.com/jobs/view/3759830955,linkedin,Network Engineer,Packet Systems Indonesia,,fulltime,2023-11-07,,,,,,0,Actively Hiring,,"Job Specification:Requirement: Hold a bachelor's degree (S-1 degree) in Information Technology Computer Engineering or Telecommunication from a reputable university with a minimum IPK of 3.0 Holding CCNP Enterprise.Minimum 5 years experience in Networking.Deep knowledge of Cisco Routing Switching Technologies, Data Center Technologies.Deep knowledge in Wireless Technologies, NAC, SDA, SDWAN.Deep Knowledge in TCP/IP & Routing (OSPF, EIGRP, BGP) Having experience in Cisco SDN Technology (SD-Access or Cisco ACI) Excellent interpersonal & communication skills. Fluent in English, good communication skills.Competent with Microsoft Office applications i.e. Microsoft Visio, Word, Excel, and PowerPoint. Ability to perform under pressure and tight time constraints; be able to work under limited guidance in line with a broad plan, or strategy. Leadership, teamwork, commitment, and service excellence are personal qualities. Job Description: Report to: Team Leader Role shall cover: For Project based: Support for a new installation, integration into the existing system, migration, and monitoring. Including all documentation related to the project (Site Survey, MoP, UAT, as build documentation). For Maintenance based: Support for troubleshooting problems in all PSI customers. Also, support for change requests in the customer network. Including reporting, documentation, and standby monitoring."
https://www.linkedin.com/jobs/view/3758270233,linkedin,Network Administrator,Truelancer.com,,fulltime,,,,,,,0,Actively Hiring,,"Experience: 3+ yearsWe are looking for an experienced Network Administrator to join our team. As a Network Administrator, you will be responsible for managing and maintaining our organization's network infrastructure to ensure its reliability, security, and performance.Key Responsibilities for this Role:Design, configure, and maintain network infrastructure, including routers, switches, firewalls, and wireless access points.Monitor network performance and troubleshoot issues to ensure optimal network operation.Implement and maintain network security measures to protect the organization's data and systems.Collaborate with IT teams to plan and implement network upgrades and expansions.Manage network user accounts, permissions, and access rights.Perform regular backups and disaster recovery planning to ensure data integrity.Stay current with industry trends and best practices to recommend network improvements.Requirements:Minimum of 3+ years of experience as a Network Administrator or in a similar role.Proficiency in network management, configuration, and troubleshooting.Strong knowledge of network protocols, security, and best practices.Experience with network hardware and software, including Cisco, Juniper, or similar technologies.Familiarity with firewall and intrusion detection/prevention systems.Excellent problem-solving skills and the ability to diagnose and resolve network issues.Network-related certifications (e.g., CCNA, CCNP) are a plus.Preferred Skills:Network infrastructure management, routing and switching, network security, firewall administration.Effective communication, teamwork, attention to detail, time management, and the ability to work under pressure.Join our team as an experienced Network Administrator ensuring network reliability, security, and top performance."
https://www.linkedin.com/jobs/view/3742032902,linkedin,Senior Network Engineer,Wings Group Indonesia (Sayap Mas Utama),,fulltime,2023-10-18,,,,,,0,Actively Hiring,,"ResponsibilitiesPerform Configuration & Implementation on Routers and SwitchManage day to day Network issue by ticket systemMaintain management security system by monitoring network, access point, firewall, IDS, CCTV, & IPS etc.Maintain Daily operation in Network System and InfrastructureInstalling, configuring, and supporting firewalls to ensure network securityProviding the best possible efficiency in an office's IT infrastructure, especially in all related to network mattersEnsuring that networks have maximum uptime, providing fast and reliable connections for all usersRequirementsCandidate must possess at least Bachelor's Degree in Technical Information / Information System or any major with minimum GPA 3.00 (on a scale of 4.0)Minimum 5 Years Experience in Network Engineer FieldProven Experience in Managing Team is strongly preferredPossess CCIE / CCNP Certification is strongly preferredHaving a strong analysis, problem solving skills, initiative, team work & Excellent communication skillUnderstand Cisco Command (Main), Juniper, Aruba, Voip devicesPreferable having good knowledge about Operating Systems Windows, Linux, HP-UXHaving good knowledge about management security (monitoring network, firewell, IDS, IPS, Ethical Hacking)"
https://www.linkedin.com/jobs/view/3741528274,linkedin,Network Engineer,PT. Kairos Utama Indonesia,,contract,2023-10-16,,,,,,0,,,"PT. Kairos Utama Indonesia is looking for Network Engineer with qualification and job details below:Qualifications:Minimum Educational Background in Bachelor degree of ITMinimum 2 Years Experienced in a similar positionHave knowledge about network and security productsHave experience in planning, implementation / installation, basic troubleshooting to advanced levelHave technical certification for CISCO, HP, or DELL will be a plus pointOutstanding communication and interpersonal skillsAnalytical mind with excellent data collection and analysis skillsAptitude in creative problem-solvingJob Details:Monitor network and telecommunications systems proactively to identify problems before users report problemsPerform troubleshooting and identify the main causes in the network systemPropose improvements in ensuring the optimization or development of network servicesMake backups and document the configuration of all existing network systemsAssisting service provider vendors in carrying out preventive maintenanceBenefits: Competitive salary, Allowance, Medical Insurance, Performance BonusPowered by JazzHR58cGnX4RA0"
https://www.linkedin.com/jobs/view/3751779742,linkedin,Junior Network Engineer,PT Kalos Anthrope Solusi,,fulltime,2023-10-07,,,,,,0,Be an early applicant,,"As a Network Engineer what will you do is below: Supporting daily activity in customer such as adding/changing configuration, etc Provide solutions and give recommendations to the customer according to their needs based on daily activity Preventive and corrective maintenance Troubleshooting and solving customer's problems Provide technical documentation and willingness to work with next escalation level, principal, and also 3rd partyRequirement Are Below Mandatory S1 of Bachelor Degree in Informatics Engineering, Telecommunication Engineering, Computer Science, Electrical Engineering, or related Engineering discipline Having a minimum knowledge of networking technology such as static routing, dynamic routing, switching, spanning tree, firewalls, etc. Having knowledge and familiarity with Cisco Products Having knowledge in TCP/IP, internet, and networking Ability to demostrate skills related network especially routing & switching Have a good communication skills and soft skill is preferable Willing to be placed in Jakarta"
https://www.linkedin.com/jobs/view/3751216574,linkedin,Network Engineer (L2),Packet Systems Indonesia,"Jakarta, Indonesia",,2023-11-06,,,,,,,Actively Hiring,,
https://www.linkedin.com/jobs/view/3742040003,linkedin,Network Engineer,PT Jasa Teknologi Informasi,,fulltime,2023-10-18,,,,,,0,,,"ResponsibilitiesOversee the design, implementation, and maintenance of the company's network infrastructure.Collaborate with cross-functional teams to ensure seamless integration of the network infrastructure with other systems.Plan and execute network upgrades, expansions, and migrations, ensuring minimal disruption to ongoing operations.Monitor network performance and troubleshoot issues, implementing proactive measures to optimize network performance and minimize downtime.Conduct disaster recovery operations and data backups as necessary.Implement and enforce network security measures, such as firewalls, intrusion detection systems, and access controls, to protect data center assets and ensure compliance with security standards.Develop and maintain network documentation, including network diagrams, configuration files, and standard operating procedures.Understanding emerging networking technologies, trends, and best practices, evaluating their potential impact to the overall organizational strategy.Collaborate with third-party support and service vendors to maintain network functionality and escalate issues when necessary.Analyze incidents and service requests, recommending, and implementing improvements in qualityRequirementsPossess relevant educational backgroundShow proven expertise in Network Engineering, including but not limited to: Routing & Switching, Edge & WAN Network, Network SecurityHaving Basic Knowledge in network routing (OSI Layer, TCP/IP, etc) Linux Administrator, and Networking Administrator.Have a Good interpersonal and communication skill.An ability to learn new technologies quicklyStrong documentation SkillsPossess certification: CCIE, or CCNP is a must"
https://www.linkedin.com/jobs/view/3738567698,linkedin,IT Security Engineer,PT Sampoerna Agro Tbk,,fulltime,2023-10-13,,,,,,0,,,"Support in security assessment and risk management, especially those related to ICT.Develop and implement information security plans and device and software policies (DLP/IDS/IPS/EDR/Threat Hunting).Accomplish investigations in terms of data, computer and server security.Planning and implementing data, voice and image security systems.Establishing internal and external relationships, along with implementing new security technology that is right on target.Minimum QualificationsCandidate must posses at least bachelor’s degree in Computer Science / Information Technology or equivalent. Min GPA 3.00.At least 3 years experience in related field is required for this position.Preferably have skills as an IT Security Specialist.Responsible, creative, and multitasking.Good interpersonal and communication skills, good teamwork and learning capability.Work placement : Head 0ffice Jakarta - Sampoerna Strategic Square"
https://www.linkedin.com/jobs/view/3743095079,linkedin,Network Engineer (CCNP),PT Sisindokom Lintasbuana,,,2023-10-26,,,,,,,Actively Hiring,,
https://www.linkedin.com/jobs/view/3720338494,linkedin,Network Engineer - NOC ( CCNA ),PT. GLOBAL SARANA SUKSES,,fulltime,2023-09-21,,,,,,0,,,"RequirementsProvide IT Operation Engineer on Site (Man Power Service), resources requirements :Senior Engineer (EoS Level 2) Education background : SMK, D3 Informatics, Information, Telecommunication, Computer Experience : minimum 1 year as a Network Engineer Certification : CCNA Certified Responsibility : monitoring, troubleshooting, and optimization of network infrastructures (routers and switches)Junior Engineer (EoS Level 1) Education background : SMK, D3 Informatics, Information, Telecommunication, Computer Experience : minimum 1 year as a Network Engineer Certification : CCNA CourseResponsibilitiesResponsible in monitoring, troubleshooting, and optimization network infrastructures (routers and switches)Follow to Work Schedule from SupervisorShift schedule :Day Shift : 0700 – 1700Night Shift : 1700 – 0700Working RosterOnsite working days is 6 days work and 1 day offWork schedule as per approved roaster (6 weeks onsite, 2 weeks offsite)Follow working rulesBe able to work after work hours (out of shift schedule). Resources are considered as professional coulsultant in case Supervisor ask to work."
https://www.linkedin.com/jobs/view/3742033768,linkedin,IT Network Engineer,JULO,,,2023-10-18,,,,,,,Actively Hiring,,
