job_url,site,title,company,location,job_type,date_posted,interval,min_amount,max_amount,currency,is_remote,num_urgent_words,benefits,emails,description
https://www.linkedin.com/jobs/view/3751240138,linkedin,Senior Network Engineer,PT Prospera Aswindra Teknologi,,fulltime,2023-11-06,,,,,,0,Be an early applicant,hrd@aswindra.co.id,"req :- Pendidikan min. S1- Mempunyai sertifikasi profesional seperti Cisco, Mikrotik, dan lainnya- Mempunyai pengalaman untuk Network Infrastructure / UTM Firewall / WAF / NAC / Wireless / Routing / Switch / Endpoint Security / dan lainnya- Pengalaman Network / Security Engineer min. 2 Tahun- Lancar dalam berbahasa Inggris (baik tulis maupun lisan)- Bisa bekerja sendiri maupun tim- Siap untuk travel bila dibutuhkan- Diutamakan yang berlokasi di Jakarta Barat / Tangerang dan sekitarnya- Memiliki motivasi diri, mau belajar, berorientasi pada hasil, dan mandiri.bisa di kirim CV terlebih dahulu ke hrd@aswindra.co.id"
https://www.linkedin.com/jobs/view/3707763158,linkedin,Core Solution Network Engineer,HAUD,,fulltime,2023-08-30,,,,,,0,,,"The Core Solution Network Engineer will be responsible for installations, operations and maintenance focusing on Cloud Based Telecom Messaging solutions but also spanning other HAUD Telecom solutions offered globally by the company. They will detail, coordinate and execute at both integration and operational matters, spanning all three skill areas for the solution (compute, connectivity & software) as to ensure the most timely and efficient deployments , regular anomaly detection enhancements (NMS) and rectification (troubleshooting) are achieved.Substantial internal coordination with DevOps & 24x7 NOC will be crucial, including occasional external 3rd party partners. Architecture integration design (LLD specifications) and detail planning for solution installations and upgrades will also form part of the key responsibilitiesRole and Responsibilities:Assist and Execute tasks for deployment management, Integration support, vendor operation & support management, service asset configuration & tracking service restoration, technical support, operational design, SLA/KPI management & 2nd/3rd line supportAssist in the specification’s definition and architecture design of the solution to be installed or requiring updatesCoordinate with vendors, service providers and internal resources ensuring continuous alignment and delivery of key functional and non-functional requirements of the solutionPlan, organize and manage the performance of the Solution Delivery process and where necessary initiates corrective actions to cover shortfalls in performance and delivery capabilityCoordinate with stakeholders to ensure the solution, intervention & issue is addressed at the required standard and within the planned time frame (SLAs)Assist in establishing realistic estimates for project delivery while ensuring that resources are utilised in the most efficient way, focusing on the reduction of the project delivery time while keeping the maximum quality of deliveryOccasional travel may be requiredRequirementsCloud design, integration and operations for AWS, Azure and VMware private cloudsHands on experience with Linux and Wireshark or any other network/protocol dissectors is a mustStructured and Logical Troubleshooting skills with ample hands specifically spanning: ESXi , Linux , TCP/IP , Cisco & Fortigate L3 Switches & Firewalls3+ Years experience in similar Telco / Network Engineering rolesAble to adjust plans as necessary and provide alternative strategies to meet changing operational situationsProficiency in the English language both written and verbal, good communication and reporting skillsDegree in Computer Science, Information Technology, Engineering or equivalentIdeally, the candidate will also have experience in these areas:Telco Core network element exposure and troubleshooting such as (A2P & P2A Gateways, SMSCs, STPs) are a KEY assetExperience in the telecommunications section protocols such as Sigtran/MAP & SMPP are considered as an assetHands on experience with SCTP & SMPP (utilities/libraries) in LinuxStructured and Logical Troubleshooting skills with SCTP , RabbitMQ , Redis , PostGreSql/MysqBenefitsInternational and multi-cultural working environmentGreat company benefitsStaff recognition and career growthFlexible working model (Remote or Hybrid) About Us:For most Mobile Network Operators, SMS A2P is a sleeping giant. Total addressable revenue is stagnant - coming from either fixed price wholesale, or traffic eroding price hikes. HAUD’s complete Messaging Revenue Platform is an industry game-changer allowing MNOs to break free of traditional growth constraints and create attractive revenue strategies which can be enforced through our award-winning SMS firewall and billed via automation.What is it like to work here:We are a hyper-growth, global organisation with innovation, diversity and inclusion at the heart of everything we do. We know work makes up a massive part of our lives, that’s why our flexible working model ensures that our teams have a healthy work/life balance. We invest in our employees to grow within the business and to continue to develop themselves through our learning and development programmes, providing room for internal promotion and longevity."
https://www.linkedin.com/jobs/view/3742034174,linkedin,IT Security Engineer,PT Aino Indonesia,,,2023-10-18,,,,,,,Be an early applicant,,
https://www.linkedin.com/jobs/view/3752385171,linkedin,Information Technology System Engineer,Esco,"Jakarta, Indonesia",fulltime,,,,,,,0,Be an early applicant,,"Esco Lifesciences Group provides enabling technologies, products and services to the life sciences and healthcare industries, supporting academic research and scientific discoveries, clinical practice, as well as biopharmaceutical R&D and manufacturing. Headquartered in Singapore, Esco has an extensive sales network in over 100 countries, direct sales and service offices in 24 countries, 8 manufacturing and R&D hubs in the US, Europe, the UK, China, Singapore, Indonesia, and over 1500 employees worldwide.Esco is poised to benefit from the sustained growth of the healthcare and biopharma industries in Asia and globally. Esco has achieved market leadership in China, and globally, in multiple categories within some of the fastest-growing segments — with China being its largest and fastest growing market. As a Singapore-headquartered company, Esco is a nexus of East and West, bridging technologies, products and talent across the world, with global operations spanning the US, Europe and Asia.The candidate will be a member of the Systems and Infrastructure team that manages Servers, System, PaaS and SaaS. His/her responsibilities includes the following: • Implement and Maintain systems and services across all environments in accordance to Company standards and policies. • Review or propose remediation solutions to address vulnerabilities identified and ensure the solutions are implemented within reasonable timeframe. • Manage, coordinate, and implement software/system upgrades and patches. Technical Skills Requirements: • Experience in Azure cloud and Microsoft 365. • Experience in IT System Management tool • Diploma or Bachelor’s Degree in related discipline. • Possess a valid certification in Microsoft Windows Server or equivalent. • Experience in vmware, Linux and MS SQL Server are required."
https://www.linkedin.com/jobs/view/3716461868,linkedin,Management Information System (MIS) Engineer,Michelin,,,2023-09-19,,,,,,,Actively Hiring,,
https://www.linkedin.com/jobs/view/3727421359,linkedin,Cyber Security Engineer Analyst,Astra Financial,,,2023-09-23,,,,,,,Actively Hiring,,
https://www.linkedin.com/jobs/view/3732515368,linkedin,Senior Civil Engineer,PT. Pustek E&T,,,2023-10-12,,,,,,,,,
https://www.linkedin.com/jobs/view/3744356251,linkedin,Control System Engineer,Michael Page,,fulltime,2023-10-27,,,,,,0,Be an early applicant,,"Progressive and forward-thinking business culture|Opportunity to work in a challenging but rewarding environmentAbout Our ClientA company specializes in holistic mineral project management, leveraging integrated solutions to maximize efficiency and sustainability. Our expertise transforms challenging projects into success stories.Job DescriptionLeading the control system unit for the development and implementation of both software and hardware elements; project organization and project execution of the company's project automation systems in compliance with international, national, and company standards and procedures for the best practice design, environment, health and safety.Responsible for designing, developing, installing, managing and/or maintaining equipment which is used to monitor and control process plant systems, equipment and processes.Creates cost estimates and/or bill of materials for project budgets and/or scope definition.Involve in assistance with project plant construction as well as commissioning (dry, wet and ore commissioning) and facilitates handover to site operations to comply with project Scope of Work.The Successful ApplicantBachelor's degree or higher in Electrical/Instrument EngineeringExcellent knowledge and understanding of accepted Electrical Engineering practices, design codes, and regulations.Familiar with Electrical and instrumentation Standards/Codes (IEC, IEEE, AS, NZS, ANSI, EN, ASME, ASTM, SNI, SPLN)Familiar with Local Regulations for Mineral (Gold) resource processing.Knowledgeable of the ""Safety in Design"" principle on Electrical & Instrumentation Engineering and Design workMinimum 12 years of experience as a Control Systems & Instrument Engineer (or min. 3 years of experience as Lead Control System Engineer in mineral processing industry).What's on OfferCompetitive salary benefitGood company cultureContact: Dezwin SoelaemanQuote job ref: JN-102023-6228147"
https://www.linkedin.com/jobs/view/3648567322,linkedin,"Junior Software Engineer, Backend",tiket.com,,fulltime,2023-06-21,,,,,,0,,,"We think you also hate when travel app is giving you a headache, right? A slight misinformation can ruin the trip.That is exactly what we are tackling as t-fam! Making sure that our 17+ million users have the best experience in crafting their own adventure.Your main duties in flying with usBuild and extend our backend code based on SOLID Principle and Clean CodeBuild APIs that serve our frontend apps – Benchmark and improve performanceMaintain and extend our test suiteRefactor and improve existing code to incorporate better patternsDocument and write about the workCreate unit test and implement self test to make sure the code is running wellAssist technical lead to review and follow up code that have been developedMandatory belongings that you must prepareBachelor degree or equivalent, preferably in Computer Science/Information TechnologyExperienced in using Golang and JavaExperience working with RDBMS or NoSQL is a plusExperience working with Redis and Memcached is a plusExperience with Elastic SearchExperience with CI/CD, TDD, Refactor/Rewrite systemExperience with Event-Driven Architecture such as Kafka or RabbitMQExperience with Git FlowExperience with Kubernetes is a plusKnows how to analyze logExperience with pair programming is a plusExperience with Linux syntax, Docker is a plusGood sense of prioritization and product knowledge/product ownershipCritical thinking, fast learner, and excellent communication skillsWell-motivated, responsible for the deadline, and can work under pressureIn the event that you haven’t received any updates after 3 weeks, your data will be kept and we may contact you for another career destination. Meanwhile, discover more about tiket.com on Instagram, LinkedIn, or YouTube."
https://www.linkedin.com/jobs/view/3746529416,linkedin,Software Engineer - Content & Services,Samsung Electronics Southeast Asia & Oceania,,fulltime,2023-10-23,,,,,,0,Actively Hiring,,"Position Summary Understand and implement software-related requirement accurately in order to provide Android application that meets its purpose on time. Develop software optimized for usability, performance, maintenance and etc. based on understanding the Android platform.Role And Responsibilities [Designing Android application] Participate in designing optimal Android application that meets requirement. [Implementation of Android application] Implement Android application based on specification that effectively works on Android development environment. [Securing application quality] Participate in solving issues coming from verification department or market and improving quality of Android application.Skills And Qualifications Develops professional expertise by complying with company policies and procedures Works on problems of moderate scope where analyzing situations or data requires a review on various factors Exercises judgment within defined procedures and practices to determine appropriate action Normally receives general instructions on routine work with detailed instructions on new projects or assignments Generally requires a bachelor's degree with a minimum 2 years related experience, or advanced degree without experience Please visit Samsung membership to see Privacy Policy, which defaults according to your location. You can change Country/Language at the bottom of the page. If you are European Economic Resident, please click here."
https://www.linkedin.com/jobs/view/3735006028,linkedin,Software Engineer,Hyppies.com,,,2023-10-10,,,,,,,,,
https://www.linkedin.com/jobs/view/3760630663,linkedin,Presales Engineer,CoberonChronos,,,,,,,,,,Be an early applicant,,
